episode,speakers,utterances,emotions,cleaned_utterances,hindi_utterances,english_utterances
jugalkishore.wmv,monisha,us din mega mall pe plastic ki cheezon pe 50% ki sale chal rahi thi. deewano ki tarah bhaagti hui wahan gayi aur 2 balti aur 7 drum khareedkar le aayi. par pata hain kya hua? a mere saath….dekh dekh iss gamle ko. garam sanbhar daalte hi plastic pighal gaya. ab ye srif thandi cheezein rakhne ke kaam aata hain. dekha?,sadness,u din mega mall pe plastic ki cheezon pe ki sale chal rahi thi deewano ki tarah bhaagti hui wahan gayi aur balti aur drum khareedkar le aayi par pata hain kya hua mere dekh i gamle ko garam sanbhar daalte hi plastic pighal gaya ab ye srif thandi cheezein rakhne ke kaam aata hain dekha,उस् दिन् मेग मल्ल् पे प्लस्तिच् कि चीज़ोन् पे ५०% कि सले चल् रहि थि। दीवनो कि तरह् भाग्ति हुइ वहन् गयि और् २ बल्ति और् ७ द्रुम् खरीद्कर् ले आयि। पर् पत हैन् क्य हुअ? अ मेरे साथ्…।देख् देख् इस्स् गम्ले को। गरम् सन्भर् दाल्ते हि प्लस्तिच् पिघल् गय। अब् ये स्रिफ़् थन्दि चीज़ेइन् रख्ने के काम् आत हैन्। देख?,"That day there was a sale of 50% on plastic cheese in the mega mall. She ran like a girl, went there and bought 2 buckets and 7 drums. Have you found out what happened? A mere friend…look at this old man. When hot material is added, the plastic melts. Now this comes in handy for keeping cold cheese. see?"
jugalkishore.wmv,jugalkishore,"monisha, ek tumbler kharaab ko kya saare tumbler kharaab? kal kya tu nahi kaha ki wahan se tu jo balti khareeda tha wo bohot majboot aur paisa wasool nikli?",neutral,monisha ek tumbler kharaab ko kya saare tumbler kharaab kal kya tu nahi kaha ki wahan se tu jo balti khareeda tha wo bohot majboot aur paisa wasool nikli,"मोनिश, एक् तुम्ब्लेर् खराब् को क्य सारे तुम्ब्लेर् खराब्? कल् क्य तु नहि कह कि वहन् से तु जो बल्ति खरीद थ वो बोहोत् मज्बूत् और् पैस वसूल् निक्लि?","Monisha, what is one tumbler kharaab? Didn't you say yesterday that the bucket you bought was very strong and the money was worthless?"
jugalkishore.wmv,monisha,kaha tha!,sadness,kaha tha,कह थ!,where was that!
jugalkishore.wmv,jugalkishore,"fir? ho saakta ki naisha tumbler nahi, baalti ho!",sadness,fir ho saakta ki naisha tumbler nahi baalti ho,"फ़िर्? हो साक्त कि नैश तुम्ब्लेर् नहि, बाल्ति हो!","fir? The water that can be made is not tumbler, it is bucket!"
lease1.wmv,sonya,"mom, guru saaf saaf bata raha hain ki lease ke papers salamat hain, ehi kahi hain",surprise,mom guru saaf saaf bata raha hain ki lease ke paper salamat hain ehi kahi hain,"मोम्, गुरु साफ़् साफ़् बत रह हैन् कि लेअसे के पपेर्स् सलमत् हैन्, एहि कहि हैन्","Mom, Guru is clearly telling that the lease papers are safe, where are they?"
lease1.wmv,maya ,"sonya darling, please locate those papers. ek toh municipal corporation ne hume notice bheja hain, upar se building residance association ne bhi notice bhej diya. agar char din ke andar andar hum ne wo lease ke papers submit nehi kiye, toh hum per ekkish fraud ke cases daarj ho jayenge. ",fear,sonya darling please locate paper ek toh municipal corporation ne hume notice bheja hain upar se building residance association ne bhi notice bhej diya agar char din ke andar andar hum ne wo lease ke paper submit nehi kiye toh hum per ekkish fraud ke case daarj ho jayenge,"सोन्य दर्लिन्ग्, प्लेअसे लोचते थोसे पपेर्स्। एक् तोह् मुनिचिपल् चोर्पोरतिओन् ने हुमे नोतिचे भेज हैन्, उपर् से बुइल्दिन्ग् रेसिदन्चे अस्सोचिअतिओन् ने भि नोतिचे भेज् दिय। अगर् चर् दिन् के अन्दर् अन्दर् हुम् ने वो लेअसे के पपेर्स् सुब्मित् नेहि किये, तोह् हुम् पेर् एक्किश् फ़्रौद् के चसेस् दार्ज् हो जयेन्गे। ","sonya darling, please locate those papers. Some municipal corporation has sent us a notice, on top of that the building residence association has also sent us a notice. If within four days we have not submitted the lease papers, we will have to file fraud cases against each other."
lease1.wmv,rosheh,"bechere daad bankrupt ho jayenge, sahil bhai ki gari bik jayegi, bechare ko cycle pe jana parega clinic. ",fear,bechere daad bankrupt ho jayenge sahil bhai ki gari bik jayegi bechare ko cycle pe jana parega clinic,"बेचेरे दाद् बन्क्रुप्त् हो जयेन्गे, सहिल् भै कि गरि बिक् जयेगि, बेचरे को च्य्च्ले पे जन परेग च्लिनिच्। ","The poor guy will go bankrupt, the brother's house will be sold, the poor guy will have to go to the clinic on cycles."
lease1.wmv,maya ,are clinic bhi toh bik jayega,fear,clinic bhi toh bik jayega,अरे च्लिनिच् भि तोह् बिक् जयेग,if we are a clinic then it will also be sold
lease1.wmv,rosheh,"ha sahil bhai compounder ban jayega kisi doctor ke. aur mama, aap ko toh aachar, papad aur khakra bechna parega ghar ghar pe jake. khakra le lo ",fear,ha sahil bhai compounder ban jayega kisi doctor ke aur mama aap ko toh aachar papad aur khakra bechna parega ghar ghar pe jake khakra le lo,"ह सहिल् भै चोम्पोउन्देर् बन् जयेग किसि दोच्तोर् के। और् मम, आप् को तोह् आचर्, पपद् और् खक्र बेच्न परेग घर् घर् पे जके। खक्र ले लो ","Ha Sahil Bhai, he will become a compounder and go to some doctor. And Mama, you will start selling this food, papad and food from door to door. take the food"
lease1.wmv,maya ,"sweety shail ki compounder banne tak toh baat theek thi, lekin main aachar papad aur khakra le kar ghar ghar pe nehi jane wali hun, its just too middle class. oh come on sonya think of something. ",fear,sweety shail ki compounder banne tak toh baat theek thi lekin main aachar papad aur khakra le kar ghar ghar pe nehi jane wali hun middle class oh come sonya think something,"स्वीत्य् शैल् कि चोम्पोउन्देर् बन्ने तक् तोह् बात् थीक् थि, लेकिन् मैन् आचर् पपद् और् खक्र ले कर् घर् घर् पे नेहि जने वलि हुन्, इत्स् जुस्त् तू मिद्द्ले च्लस्स्। ओह् चोमे ओन् सोन्य थिन्क् ओफ़् सोमेथिन्ग्। ","All this was done till the sweety shell compounder was made, but the main aachar papad and food was not made in every household, its just too middle class. oh come on sonya think of something."
lease1.wmv,sonya,"oh mom please give me some time, let me think. ",neutral,oh mom please give time let think,"ओह् मोम् प्लेअसे गिवे मे सोमे तिमे, लेत् मे थिन्क्। ","oh mom please give me some time, let me think."
lease1.wmv,maya ,kuch sujha?,neutral,kuch sujha,कुच् सुझ?,how much is it?
lease1.wmv,sonya,ek rasta hain,joy,ek rasta hain,एक् रस्त हैन्,there is a way
lease1.wmv,maya ,keya,surprise,keya,केय,key
lease1.wmv,sonya,"sirf baa jante the lease ke papers kaha rakhe hain, right? ",neutral,sirf baa jante lease ke paper kaha rakhe hain right,"सिर्फ़् बा जन्ते थे लेअसे के पपेर्स् कह रखे हैन्, रिघ्त्? ","Only you know where the lease papers are kept, right?"
lease1.wmv,maya ,unfortunately,sadness,unfortunately,उन्फ़ोर्तुनतेल्य्,unfortunately
lease1.wmv,sonya,"toh agar hum baa se hi puche papers kaha hain, toh? ",neutral,toh agar hum baa se hi puche paper kaha hain toh,"तोह् अगर् हुम् बा से हि पुचे पपेर्स् कह हैन्, तोह्? ","so if we have already said that we have had many papers, so?"
lease1.wmv,rosheh,"oh my god, wo upar swarg main hain, uha kyun jayega? ",fear,oh god wo upar swarg main hain uha kyun jayega,"ओह् म्य् गोद्, वो उपर् स्वर्ग् मैन् हैन्, उह क्युन् जयेग? ","oh my god, you are in heaven, why will you go there?"
lease1.wmv,sonya,"oh silly boy, hum baa ke atma ko niche bulanyenge. ",joy,oh silly boy hum baa ke atma ko niche bulanyenge,"ओह् सिल्ल्य् बोय्, हुम् बा के अत्म को निचे बुलन्येन्गे। ","oh silly boy, let us find a niche for our soul."
lease1.wmv,maya ,oh you mean,joy,oh mean,ओह् योउ मेअन्,oh you mean
lease1.wmv,monisha,main janti hun ek agori baba ko. wo 100 100 rupay main jiski chaho uski atma ko niche bula dete hain,joy,main janti hun ek agori baba ko wo rupay main jiski chaho uski atma ko niche bula dete hain,मैन् जन्ति हुन् एक् अगोरि बब को। वो १०० १०० रुपय् मैन् जिस्कि चहो उस्कि अत्म को निचे बुल देते हैन्,I am a proud father. Those who pay 100 rupees can open the niche for anyone's soul.
lease1.wmv,sonya,"bhabhi 100 rupay main kohi taxi main baith kar kandivali se kolawa bhi nehi ja sakta, toh kohi upar se iha niche kaise aa sakta hain ",contempt,bhabhi rupay main kohi taxi main baith kar kandivali se kolawa bhi nehi ja sakta toh kohi upar se iha niche kaise aa sakta hain,"भभि १०० रुपय् मैन् कोहि तक्षि मैन् बैथ् कर् कन्दिवलि से कोलव भि नेहि ज सक्त, तोह् कोहि उपर् से इह निचे कैसे आ सक्त हैन् ","Bhabhi, you can't even go to Kandivali by taking a taxi with just 100 rupees, so how can you reach this niche from above."
lease1.wmv,maya ,"and besides agori baba is just too downmarket. sonya, tum kisi paranormal studies ya occult science ke expert baba ko nehi janti? ",neutral,besides agori baba downmarket sonya tum kisi paranormal study ya occult science ke expert baba ko nehi janti,"अन्द् बेसिदेस् अगोरि बब इस् जुस्त् तू दोव्न्मर्केत्। सोन्य, तुम् किसि परनोर्मल् स्तुदिएस् य ओच्चुल्त् स्चिएन्चे के एक्ष्पेर्त् बब को नेहि जन्ति? ","and besides agori baba is just too downmarket. sonya, don't you know any expert father of paranormal studies or occult science?"
lease1.wmv,sonya,"yes mom, ek occult science ka student hain, krish majumder. ",joy,yes mom ek occult science ka student hain krish majumder,"येस् मोम्, एक् ओच्चुल्त् स्चिएन्चे क स्तुदेन्त् हैन्, क्रिश् मजुम्देर्। ","yes mom, he is a student of occult science, Krish Majumder."
lease1.wmv,maya ,"oh you mean sanjeevani and santanu majumder ka baba, i mean beta ",neutral,oh mean sanjeevani santanu majumder ka baba mean beta,"ओह् योउ मेअन् सन्जीवनि अन्द् सन्तनु मजुम्देर् क बब, इ मेअन् बेत ","oh you mean sanjeevani and santanu majumder ka baba, i mean son"
lease1.wmv,sonya,yaaaa,joy,yaaaa,याआ,yaaaaa
lease1.wmv,monisha,wo jante hain bhut pret ko bulana?,joy,wo jante hain bhut pret ko bulana,वो जन्ते हैन् भुत् प्रेत् को बुलन?,Do you know how to call great love?
lease1.wmv,maya ,monisha please bhut pret kahe karke use cheapen maat karo,contempt,monisha please bhut pret kahe karke use cheapen maat karo,मोनिश प्लेअसे भुत् प्रेत् कहे कर्के उसे चेअपेन् मात् करो,monisha please use bhut pret karke cheap maat karo
lease1.wmv,sonya,its called atma ropon proyog,neutral,called atma ropon proyog,इत्स् चल्लेद् अत्म रोपोन् प्रोयोग्,Its called Atma Ropon Proyog.
lease1.wmv,maya ,that sounds classier,joy,sound classier,थत् सोउन्द्स् च्लस्सिएर्,that sounds classier
lease2.wmv,monisha ,bakura bakura iye sab keya ho raha hain? bakura kaha mar gaye sab ke sab bakura,anger,bakura bakura iye sab keya ho raha hain bakura kaha mar gaye sab ke sab bakura,बकुर बकुर इये सब् केय हो रह हैन्? बकुर कह मर् गये सब् के सब् बकुर,Bakura Bakura what are you doing? bakura said kill everyone bakura
lease2.wmv,indu,"are baa baa dekho, dulhan aa gayi baa",joy,baa baa dekho dulhan aa gayi baa,"अरे बा बा देखो, दुल्हन् आ गयि बा","are baa baa look, the bride is gayi baa"
lease2.wmv,rosesh,lekin baa ko pata chal geya to?,fear,lekin baa ko pata chal geya,लेकिन् बा को पत चल् गेय तो?,But did you find out where you went?
lease2.wmv,indu,"chup kisi ko kuch pata nehi chalega. are baa ko manane ka ihi ek tarika hain. nakli saadi, nakli dulhan samjha. aur sun tu ihi khada rahe, mai jar bulaun tab ana. ",neutral,chup kisi ko kuch pata nehi chalega baa ko manane ka ihi ek tarika hain nakli saadi nakli dulhan samjha aur sun tu ihi khada rahe mai jar bulaun tab ana,"चुप् किसि को कुच् पत नेहि चलेग। अरे बा को मनने क इहि एक् तरिक हैन्। नक्लि सादि, नक्लि दुल्हन् सम्झ। और् सुन् तु इहि खद रहे, मै जर् बुलौन् तब् अन। ","Nobody knows anything. This is one way to convince them. Nakli Saadi, Nakli Dulhan Samjha. And if you are eating the same thing, I will add some more."
lease2.wmv,monisha ,bakura,neutral,bakura,बकुर,bakura
lease2.wmv,indu,"haa baa baa, dekho aapki dulhan aa gayi. ",joy,haa baa baa dekho aapki dulhan aa gayi,"हा बा बा, देखो आप्कि दुल्हन् आ गयि। ","Haa baa baa, look at your bride aa gayi."
lease2.wmv,monisha ,"iye sab keya ho raha hain daddy ji, kaisa halkat appka. sahil ne toh haa kar di. ",fear,iye sab keya ho raha hain daddy ji kaisa halkat appka sahil ne toh haa kar di,"इये सब् केय हो रह हैन् दद्द्य् जि, कैस हल्कत् अप्प्क। सहिल् ने तोह् हा कर् दि। ","What are you saying, daddy, how are you? The shore has done this."
lease2.wmv,indu,"fikar mat karo. rosesh ko main le aya hun dulhan banake, sab thik ho jayega. aha, rashika baby, ayo ato baa ke paho paro, ayo",joy,fikar mat karo rosesh ko main le aya hun dulhan banake sab thik ho jayega aha rashika baby ayo ato baa ke paho paro ayo,"फ़िकर् मत् करो। रोसेश् को मैन् ले अय हुन् दुल्हन् बनके, सब् थिक् हो जयेग। अह, रशिक बब्य्, अयो अतो बा के पहो परो, अयो","Don't worry. I have come to take care of Rose and make her a bride, everything will be fine. aha, Rashika baby, come on, come see me, come on!"
lease2.wmv,sahil,"rukiye. daad, baa ko dhoka dete hue aapko saram nehi ayi? ",contempt,rukiye daad baa ko dhoka dete hue aapko saram nehi ayi,"रुकिये। दाद्, बा को धोक देते हुए आप्को सरम् नेहि अयि? ","wait. Dad, you cheated on your father, don't you care?"
lease2.wmv,indu,"are, maine keya dhoka diya? mai toh iye",fear,maine keya dhoka diya mai toh iye,"अरे, मैने केय धोक दिय? मै तोह् इये","are, what did I betray? I am here"
lease2.wmv,monisha ,keya hua babla? ,neutral,keya hua babla,केय हुअ बब्ल? ,what happened babble?
lease2.wmv,sahil,"iye dulhan nehi hain baa, rosesh hai.",anger,iye dulhan nehi hain baa rosesh hai,"इये दुल्हन् नेहि हैन् बा, रोसेश् है।","This is not a bride, it is a rose."
lease2.wmv,rosesh,hi baa,neutral,hi baa,हि बा,hi baa
lease2.wmv,monisha ,keya bakura ,surprise,keya bakura,केय बकुर ,key bakura
lease2.wmv,sahil,"daad, aapki ma ke sath aapne itna bara biswasghat kiya ",contempt,daad aapki ke sath aapne itna bara biswasghat kiya,"दाद्, आप्कि म के सथ् आप्ने इत्न बर बिस्वस्घत् किय ","Dad, I disappointed you so much with your mother."
lease2.wmv,monisha ,waise babla iye rosesh bhi itna bura nehi lag raha hai. ise le jaa,neutral,waise babla iye rosesh bhi itna bura nehi lag raha hai ise le jaa,वैसे बब्ल इये रोसेश् भि इत्न बुर नेहि लग् रह है। इसे ले जा,"By the way, Baba, even this rose is not looking so bad. take it away"
lease2.wmv,sahil,nehi baa nehi. aapki aakhri iccha ke sath mai itna bara khilwat nehi hone dunga. mom,neutral,nehi baa nehi aapki aakhri iccha ke sath mai itna bara khilwat nehi hone dunga mom,नेहि बा नेहि। आप्कि आख्रि इच्च के सथ् मै इत्न बर खिल्वत् नेहि होने दुन्ग। मोम्,nehi baa nehi. I won't let this mess happen with your last love. mom
lease2.wmv,maya,ha ha ilaben jaldi aa bhi jao. mandap puraj bas suru hone hi wala hain. sarita ki beti preeti ke saath finally saadi ho raha hai meri sahil ki ,joy,ha ha ilaben jaldi aa bhi jao mandap puraj ba suru hone hi wala hain sarita ki beti preeti ke saath finally saadi ho raha hai meri sahil ki,ह ह इलबेन् जल्दि आ भि जओ। मन्दप् पुरज् बस् सुरु होने हि वल हैन्। सरित कि बेति प्रीति के साथ् फ़िनल्ल्य् सादि हो रह है मेरि सहिल् कि ,ha ha ilaben come quickly also go. Mandap Puraj has just started. Sarita's daughter is finally married to Preeti and is living on my shore.
lease2.wmv,sahil,"pandit ji, aap kriyakaram suru kijiye",neutral,pandit ji aap kriyakaram suru kijiye,"पन्दित् जि, आप् क्रियकरम् सुरु किजिये","Pandit ji, you have started doing the work."
lease2.wmv,monisha ,widhi babla widhi. kriyakaram toh aab mera hoga,fear,widhi babla widhi kriyakaram toh aab mera hoga,विधि बब्ल विधि। क्रियकरम् तोह् आब् मेर होग,method babla method. If I do this then it will be mine.
lease2.wmv,maya,aapko kyun kuch hoga baa?,neutral,aapko kyun kuch hoga baa,आप्को क्युन् कुच् होग बा?,Why will you be upset?
lease2.wmv,person,jaldi aa jao bhai muhurat ka samay ho raha hai ,neutral,jaldi aa jao bhai muhurat ka samay ho raha hai,जल्दि आ जओ भै मुहुरत् क समय् हो रह है ,"Come quickly brother, it's time for the auspicious time."
lease2.wmv,maya,"are pandit ji suru kara hai, cholo cholo indu, come on rosesh ",neutral,pandit ji suru kara hai cholo cholo indu come rosesh,"अरे पन्दित् जि सुरु कर है, चोलो चोलो इन्दु, चोमे ओन् रोसेश् ","Hey Pandit ji has started, Cholo Cholo indu, come on rosesh"
lease2.wmv,indu,ha ha chalo chalo mai bhi aa jau ,joy,ha ha chalo chalo mai bhi aa jau,ह ह चलो चलो मै भि आ जौ ,ha ha let's go let's go I am also coming
lease2.wmv,monisha ,bakura,anger,bakura,बकुर,bakura
lease2.wmv,indu,haa haa baa,neutral,haa haa baa,हा हा बा,haa haa baa
lease2.wmv,monisha ,sahil babla toh saadi kar raha hai bakura ,fear,sahil babla toh saadi kar raha hai bakura,सहिल् बब्ल तोह् सादि कर् रह है बकुर ,Bakura is keeping the sea clean.
lease2.wmv,indu,"ha ha baa, mai kuch nehi kar sakta",fear,ha ha baa mai kuch nehi kar sakta,"ह ह बा, मै कुच् नेहि कर् सक्त","ha ha baa, nothing more can be done"
lease2.wmv,sahil,"rosesh baa ko iha le aao, aur preeti ki ghar pe phone karna. kahna do baaje tak iha pouche, dhai baje fir lenge",joy,rosesh baa ko iha le aao aur preeti ki ghar pe phone karna kahna baaje tak iha pouche dhai baje fir lenge,"रोसेश् बा को इह ले आओ, और् प्रीति कि घर् पे फोने कर्न। कह्न दो बाजे तक् इह पोउचे, धै बजे फ़िर् लेन्गे",Rosesh Baa brought him here and called Preeti's house. What should I say until I reach this pouch?
lease2.wmv,rosesh,okay. chaliye baa mandappuraj suru ho gayi hai,joy,okay chaliye baa mandappuraj suru ho gayi hai,ओकय्। चलिये बा मन्दप्पुरज् सुरु हो गयि है,okay. let's go mandappuraj has started singing
lease2.wmv,monisha ,bakura bakura,fear,bakura bakura,बकुर बकुर,bakura bakura
lease2.wmv,person,[chants mantra],neutral,chant mantra,[चन्त्स् मन्त्र],[chants mantra]
lease2.wmv,indu,hey sahil tere saadi toh ho chuki hai,neutral,hey sahil tere saadi toh ho chuki hai,हेय् सहिल् तेरे सादि तोह् हो चुकि है,hey the shore has become so clean
lease2.wmv,sahil,"daad building bachane hai ki nehi. aur waise bhi aaj aakhri din hai, lease hasil karni hain. ",neutral,daad building bachane hai ki nehi aur waise bhi aaj aakhri din hai lease hasil karni hain,"दाद् बुइल्दिन्ग् बचने है कि नेहि। और् वैसे भि आज् आख्रि दिन् है, लेअसे हसिल् कर्नि हैन्। ","Don't you want to save the concrete building? And by the way, today is the last day, at least results are being achieved."
lease2.wmv,maya,"absolutely. desperate timess, desperate measures. infact agar baa mujhe bhi kahe na toh mai bhi saadi karne ke liye taiyaar ho jayun. ",neutral,absolutely desperate times desperate measure infact agar baa mujhe bhi kahe na toh mai bhi saadi karne ke liye taiyaar ho jayun,"अब्सोलुतेल्य्। देस्पेरते तिमेस्स्, देस्पेरते मेअसुरेस्। इन्फ़च्त् अगर् बा मुझे भि कहे न तोह् मै भि सादि कर्ने के लिये तैयार् हो जयुन्। ","absolutely. desperate times, desperate measures. In fact, if Baa had told me too, I would have been ready to marry him."
lease2.wmv,monisha ,bakura ,anger,bakura,बकुर ,bakura
lease2.wmv,maya ,chaliye,neutral,chaliye,चलिये,drive
lease2.wmv,person,[chants mantra],neutral,chant mantra,[चन्त्स् मन्त्र],[chants mantra]
lease2.wmv,monisha ,"hey pandit ji ruk jao, ruk jao iye. babla mujhe tere iye kapre bilkul pasand nehi hai, tu nayi kapre leke aa, fir saadi karna haa? ",neutral,hey pandit ji ruk jao ruk jao iye babla mujhe tere iye kapre bilkul pasand nehi hai tu nayi kapre leke aa fir saadi karna haa,"हेय् पन्दित् जि रुक् जओ, रुक् जओ इये। बब्ल मुझे तेरे इये कप्रे बिल्कुल् पसन्द् नेहि है, तु नयि कप्रे लेके आ, फ़िर् सादि कर्न हा? ","hey pandit ji stop, please stop. Babla, I don't like you at all, why did you come here, then why do you want to marry me?"
