episode,speakers,utterances,emotions,cleaned_utterances,hindi_utterances,english_utterances
monishaadaptstohighsociety,monisha,"rule number sixteen mom..nau baje rakhi hui party me sharp nau baje sirf middle class log pahunchte hain..haanth jod ke aaiye aaiye kehne ke liye..khud ki di hui party me kam se kam ek ghanta late pahunchna is a style statement..rosesh, rule dikhao na",neutral,rule number sixteen mom nau baje rakhi hui party sharp nau baje sirf middle class log pahunchte hain haanth jod ke aaiye aaiye kehne ke liye khud ki di hui party kam se kam ek ghanta late pahunchna style statement rosesh rule dikhao na,"रुले नुम्बेर् सिक्ष्तीन् मोम्॥नौ बजे रखि हुइ पर्त्य् मे शर्प् नौ बजे सिर्फ़् मिद्द्ले च्लस्स् लोग् पहुन्च्ते हैन्॥हान्थ् जोद् के आइये आइये केह्ने के लिये॥खुद् कि दि हुइ पर्त्य् मे कम् से कम् एक् घन्त लते पहुन्च्न इस् अ स्त्य्ले स्ततेमेन्त्॥रोसेश्, रुले दिखओ न","rule number sixteen mom..now it's time to keep the party sharp now it's only the middle class people who have reached..the hundredth couple has come to say..arriving at least one hour late in the party itself is a style statement. Rosesh, show me the rule."
monishaadaptstohighsociety,rosesh,oh yeah yeah..momma ye..,neutral,oh yeah yeah momma ye,ओह् येअह् येअह्॥मोम्म ये॥,oh yes yes..momma yes..
monishaadaptstohighsociety,maya,"tum mujhe kya rule dikhane lage..monisha, gyarah baar maine tumhein phone kiya gyarah baar..har baar this phone is not reachable",anger,tum mujhe kya rule dikhane lage monisha gyarah baar maine tumhein phone kiya gyarah baar har baar phone reachable,"तुम् मुझे क्य रुले दिखने लगे॥मोनिश, ग्यरह् बार् मैने तुम्हेइन् फोने किय ग्यरह् बार्॥हर् बार् थिस् फोने इस् नोत् रेअचब्ले","What rule should you show me? Monisha, I called you again and again.. every time this phone is not reachable."
monishaadaptstohighsociety,monisha,"i'm sorry mom, wo mera phone mere assistant phillip ke paas tha. you see khud ka mobile khud carry karna is so crude and down market..right rosesh",contempt,sorry mom wo mera phone mere assistant phillip ke paas tha see khud ka mobile khud carry karna crude market right rosesh,"इ'म् सोर्र्य् मोम्, वो मेर फोने मेरे अस्सिस्तन्त् फिल्लिप् के पास् थ। योउ सी खुद् क मोबिले खुद् चर्र्य् कर्न इस् सो च्रुदे अन्द् दोव्न् मर्केत्॥रिघ्त् रोसेश्","I'm sorry mom, my phone was with my assistant Phillip. you see khud ka mobile khud carry karna is so crude and down market..right rosesh"
monishaadaptstohighsociety,maya,tumhein iss tarah se behave karne me maza aata hai monisha,anger,tumhein i tarah se behave karne maza aata hai monisha,तुम्हेइन् इस्स् तरह् से बेहवे कर्ने मे मज़ आत है मोनिश,It's fun to behave like this with you Monisha
monishaadaptstohighsociety,monisha,"um..mom, mai aap logon ka dinner yahin bhejwa deti hun..and mom, kal mere yahan pe cards and cocktail ki party hai, aap jarur aaiyega okay? ciao",joy,um mom mai aap logon ka dinner yahin bhejwa deti hun mom kal mere yahan pe card cocktail ki party hai aap jarur aaiyega okay ciao,"उम्॥मोम्, मै आप् लोगोन् क दिन्नेर् यहिन् भेज्व देति हुन्॥अन्द् मोम्, कल् मेरे यहन् पे चर्द्स् अन्द् चोच्क्तैल् कि पर्त्य् है, आप् जरुर् आइयेग ओकय्? चिअओ","um..mom, I am sending you guys dinner here..and mom, there is a cards and cocktail party at my place tomorrow, you will definitely come okay? ciao"
monishaadaptstohighsociety,maya,you know i think we've created a frankenstein's monster,anger,know think created frankenstein monster,योउ क्नोव् इ थिन्क् वे'वे च्रेअतेद् अ फ़्रन्केन्स्तेइन्'स् मोन्स्तेर्,you know i think we've created a frankenstein's monster
monishaadaptstohighsociety,rosesh,simple aunty ne sir pe chadhaya hai monisha bhabhi ko,anger,simple aunty ne sir pe chadhaya hai monisha bhabhi ko,सिम्प्ले औन्त्य् ने सिर् पे चधय है मोनिश भभि को,simple aunty licks monisha bhabhi on head
monishaadaptstohighsociety,maya,"argh..that simple, i tell you..wo to bilkul..wo kya gaaliyan deti thi monisha?",anger,argh simple tell wo bilkul wo kya gaaliyan deti thi monisha,"अर्घ्॥थत् सिम्प्ले, इ तेल्ल् योउ॥वो तो बिल्कुल्॥वो क्य गालियन् देति थि मोनिश?","argh..that simple, I tell you..wo to bilkul..wo kya gaaliyan deti thi monisha?"
monishaadaptstohighsociety,rosesh,kutti kamini haramzaadi,neutral,kutti kamini haramzaadi,कुत्ति कमिनि हरम्ज़ादि,kutti kamini haramzaadi
monishaadaptstohighsociety,maya,"right. kutti kamini haramzaadi hai wo simple..haa aan..kya se kya bana diya hai usne humari bholi bhali monisha ko..wo purani wali monisha kahan gayi, i miss her so much..wo wapas aaegi kya?",sadness,right kutti kamini haramzaadi hai wo simple haa aan kya se kya bana diya hai usne humari bholi bhali monisha ko wo purani wali monisha kahan gayi miss much wo wapas aaegi kya,"रिघ्त्। कुत्ति कमिनि हरम्ज़ादि है वो सिम्प्ले॥हा आन्॥क्य से क्य बन दिय है उस्ने हुमरि भोलि भलि मोनिश को॥वो पुरनि वलि मोनिश कहन् गयि, इ मिस्स् हेर् सो मुच्॥वो वपस् आएगि क्य?","right. You bitch, you are a bastard, she is so simple..haa aan..what have you done to us, our innocent Monisha..where did that old Monisha go, I miss her so much..will she come back?"
roseshnayadon.wmv,raj gopal sharma,rosesh ready for the shot?,neutral,rosesh ready shot,रोसेश् रेअद्य् फ़ोर् थे शोत्?,rosesh ready for the shot?
roseshnayadon.wmv,rosesh,yeah yeah,neutral,yeah yeah,येअह् येअह्,yes yes
roseshnayadon.wmv,rosesh,sahil bhai ,neutral,sahil bhai,सहिल् भै ,sahil bhai
roseshnayadon.wmv,raj gopal sharma,arey roko isse field mein jaa rahe hai,fear,arey roko isse field mein jaa rahe hai,अरेय् रोको इस्से फ़िएल्द् मेइन् जा रहे है,hey stop he is going in this field
roseshnayadon.wmv,assistant,excuse me aap field mein nahi jaa sakte ,anger,excuse aap field mein nahi jaa sakte,एक्ष्चुसे मे आप् फ़िएल्द् मेइन् नहि जा सक्ते ,excuse me you can't go to the field
roseshnayadon.wmv,madhusudan,madhusudhan,neutral,madhusudhan,मधुसुधन्,madhusudhan
roseshnayadon.wmv,assistant,sir wo field hai,fear,sir wo field hai,सिर् वो फ़िएल्द् है,sir that's the field
roseshnayadon.wmv,madhusudan,madhusudhan fufa,neutral,madhusudhan fufa,मधुसुधन् फ़ुफ़,madhusudhan uncle
roseshnayadon.wmv,sahil,i am sorry brother,sadness,sorry brother,इ अम् सोर्र्य् ब्रोथेर्,i am sorry brother
roseshnayadon.wmv,rosesh,it's ok ,joy,ok,इत्'स् ओक् ,it's okay
roseshnayadon.wmv,sahil,all the best and just go and ..,neutral,best go,अल्ल् थे बेस्त् अन्द् जुस्त् गो अन्द् ॥,all the best and just go and..
roseshnayadon.wmv,monisha,band baja do uss raj gopal sharma ki ,joy,band baja us raj gopal sharma ki,बन्द् बज दो उस्स् रज् गोपल् शर्म कि ,band baja do us raj gopal sharma ki
roseshnayadon.wmv,raj gopal sharma,family drama khatam ho gaya ho toh kaam shuru karein ,contempt,family drama khatam ho gaya ho toh kaam shuru karein,फ़मिल्य् द्रम खतम् हो गय हो तोह् काम् शुरु करेइन् ,I have finished the family drama so now I am starting it.
roseshnayadon.wmv,rosesh,go go go,neutral,go go go,गो गो गो,go go go
roseshnayadon.wmv,assistant,ready sir?,neutral,ready sir,रेअद्य् सिर्?,ready sir?
roseshnayadon.wmv,rosesh,yes sir,neutral,yes sir,येस् सिर्,yes sir
roseshnayadon.wmv,assistant,ready?,neutral,ready,रेअद्य्?,ready?
roseshnayadon.wmv,rosesh,yes,neutral,yes,येस्,yes
roseshnayadon.wmv,raj gopal sharma,role ,neutral,role,रोले ,role
roseshnayadon.wmv,assistant2,roling,neutral,roling,रोलिन्ग्,rolling
roseshnayadon.wmv,raj gopal sharma,action,neutral,action,अच्तिओन्,action
roseshnayadon.wmv,rosesh,mumbai ka raja khailayega kaun pak gaya maathe ye naya don,neutral,mumbai ka raja khailayega kaun pak gaya maathe ye naya,मुम्बै क रज खैलयेग कौन् पक् गय माथे ये नय दोन्,Who will give this new gift to the king of Mumbai?
roseshnayadon.wmv,raj gopal sharma,cut! ye kyu aise bol raha hai. rosesh normally bolo ,neutral,cut ye kyu aise bol raha hai rosesh normally bolo,चुत्! ये क्यु ऐसे बोल् रह है। रोसेश् नोर्मल्ल्य् बोलो ,cut! Why is he hurting so much? rosesh spoke normally
roseshnayadon.wmv,rosesh,normal hi tha sir,neutral,normal hi tha sir,नोर्मल् हि थ सिर्,normal hi tha sir
roseshnayadon.wmv,raj gopal sharma,toh abnormal bolo,surprise,toh abnormal bolo,तोह् अब्नोर्मल् बोलो,that seemed abnormal
roseshnayadon.wmv,rosesh,ok,neutral,ok,ओक्,ok
roseshnayadon.wmv,rosesh,mumbai ka raja khailayega kaun pak gaya maathe ye naya don,neutral,mumbai ka raja khailayega kaun pak gaya maathe ye naya,मुम्बै क रज खैलयेग कौन् पक् गय माथे ये नय दोन्,Who will give this new gift to the king of Mumbai?
roseshnayadon.wmv,raj gopal sharma,cut cut itna abnormally nahin thoda kam beech wala ok?,anger,cut cut itna abnormally nahin thoda kam beech wala ok,चुत् चुत् इत्न अब्नोर्मल्ल्य् नहिन् थोद कम् बीच् वल ओक्?,"Cut cut, it's not abnormal, a little less beech was ok?"
roseshnayadon.wmv,rosesh,ok,neutral,ok,ओक्,ok
roseshnayadon.wmv,rosesh,mumbai ka raja khailayega kaun pak gaya maathe ye naya don,neutral,mumbai ka raja khailayega kaun pak gaya maathe ye naya,मुम्बै क रज खैलयेग कौन् पक् गय माथे ये नय दोन्,Who will give this new gift to the king of Mumbai?
roseshnayadon.wmv,raj gopal sharma,cut! action,anger,cut action,चुत्! अच्तिओन्,cut! action
roseshnayadon.wmv,rosesh,mumbai ka raja khailayega kaun pak gaya maathe ye naya don,neutral,mumbai ka raja khailayega kaun pak gaya maathe ye naya,मुम्बै क रज खैलयेग कौन् पक् गय माथे ये नय दोन्,Who will give this new gift to the king of Mumbai?
roseshnayadon.wmv,raj gopal sharma,cut! action,anger,cut action,चुत्! अच्तिओन्,cut! action
roseshnayadon.wmv,rosesh,mumbai ka raja khailayega kaun pak gaya maathe ye naya don,neutral,mumbai ka raja khailayega kaun pak gaya maathe ye naya,मुम्बै क रज खैलयेग कौन् पक् गय माथे ये नय दोन्,Who will give this new gift to the king of Mumbai?
roseshnayadon.wmv,raj gopal sharma,cut! action,anger,cut action,चुत्! अच्तिओन्,cut! action
roseshnayadon.wmv,rosesh,mumbai ka raja khailayega kaun pak gaya maathe ye naya don,neutral,mumbai ka raja khailayega kaun pak gaya maathe ye naya,मुम्बै क रज खैलयेग कौन् पक् गय माथे ये नय दोन्,Who will give this new gift to the king of Mumbai?
roseshnayadon.wmv,raj gopal sharma,ok,joy,ok,ओक्,ok
roseshnayadon.wmv,maya,ye ok tha ?,surprise,ye ok tha,ये ओक् थ ?,was this ok?
roseshnayadon.wmv,raj gopal sharma,ji nahi ,neutral,ji nahi,जि नहि ,ji nahi
roseshnayadon.wmv,maya,par aapne ok kaha,neutral,par aapne ok kaha,पर् आप्ने ओक् कह,but you said ok
roseshnayadon.wmv,raj gopal sharma,ok ye ladka zindagi bhar actor nahi ban sakta ye wo waala ok tha ,anger,ok ye ladka zindagi bhar actor nahi ban sakta ye wo waala ok tha,ओक् ये लद्क ज़िन्दगि भर् अच्तोर् नहि बन् सक्त ये वो वाल ओक् थ ,"ok this boy is not an actor in life, he was ok tha"
roseshnayadon.wmv,raj gopal sharma,pack up,neutral,pack,पच्क् उप्,pack up
roseshnayadon.wmv,sahil,arey ek minute excuse me director sahab just give him one more ,fear,arey ek minute excuse director sahab give one,अरेय् एक् मिनुते एक्ष्चुसे मे दिरेच्तोर् सहब् जुस्त् गिवे हिम् ओने मोरे ,arey one minute excuse me director sahab just give him one more
roseshnayadon.wmv,rosesh,rehne dijiye sahil bhai meri 39 mei se ek bhi style inhe pasand nahi aayi ,sadness,rehne dijiye sahil bhai meri mei se ek bhi style inhe pasand nahi aayi,रेह्ने दिजिये सहिल् भै मेरि ३९ मेइ से एक् भि स्त्य्ले इन्हे पसन्द् नहि आयि ,"Leave it alone bhai, I haven't liked any of his styles since I was 39."
roseshnayadon.wmv,monisha,matlab rosesh bhaiya ab hero nahi banenge. baldev uncle ne ghar mein jo surprise party rakhi hai hum kya karenge mummy ji ,fear,matlab rosesh bhaiya ab hero nahi banenge baldev uncle ne ghar mein jo surprise party rakhi hai hum kya karenge mummy ji,मत्लब् रोसेश् भैय अब् हेरो नहि बनेन्गे। बल्देव् उन्च्ले ने घर् मेइन् जो सुर्प्रिसे पर्त्य् रखि है हुम् क्य करेन्गे मुम्म्य् जि ,"Meaning: Rosesh bhaiya will not become a hero. Baldev uncle has organized a surprise party at home, what should we do mummy ji?"
roseshnayadon.wmv,maya,arey kyun? sahil ko bhi toh award milne wala hai. i mean harvard medical journal mein iska research chapne wala hai that's not a small thing i am so proud of you darling ,joy,arey kyun sahil ko bhi toh award milne wala hai mean harvard medical journal mein iska research chapne wala hai small thing proud darling,अरेय् क्युन्? सहिल् को भि तोह् अवर्द् मिल्ने वल है। इ मेअन् हर्वर्द् मेदिचल् जोउर्नल् मेइन् इस्क रेसेअर्च् चप्ने वल है थत्'स् नोत् अ स्मल्ल् थिन्ग् इ अम् सो प्रोउद् ओफ़् योउ दर्लिन्ग् ,arey why? Sahil is also going to get that award. i mean harvard medical journal mein iska research chapne wala hai that's not a small thing i am so proud of you darling
roseshnayadon.wmv,monisha,mei bhi lekin sahil trophy steel ki maangna haan,joy,mei bhi lekin sahil trophy steel ki maangna haan,मेइ भि लेकिन् सहिल् त्रोफ्य् स्तील् कि मान्ग्न हान्,I too but want beach trophy steel
roseshnayadon.wmv,sahil,can you just chill guys? please? rosesh dekh dil chota mat kar  ,neutral,chill guy please rosesh dekh dil chota mat kar,चन् योउ जुस्त् चिल्ल् गुय्स्? प्लेअसे? रोसेश् देख् दिल् चोत मत् कर्  ,can you just chill guys? please? seeing roses breaks my heart
roseshnayadon.wmv,rosesh,meine toh interview bhi dediya hai sahil bhai ,sadness,meine toh interview bhi dediya hai sahil bhai,मेइने तोह् इन्तेर्विएव् भि देदिय है सहिल् भै ,You have also given me an interview Sahil Bhai
roseshnayadon.wmv,maya,haan toh keh denge tumne script padhne ke baad reject kar di thi film it was just too down market ,contempt,haan toh keh denge tumne script padhne ke baad reject kar di thi film market,हान् तोह् केह् देन्गे तुम्ने स्च्रिप्त् पध्ने के बाद् रेजेच्त् कर् दि थि फ़िल्म् इत् वस् जुस्त् तू दोव्न् मर्केत् ,"Why do you think you rejected this film after reading the script, it was just too down market."
roseshnayadon.wmv,sahil,aur tum koi classy crossover film karne america gaye ,neutral,aur tum koi classy crossover film karne america gaye,और् तुम् कोइ च्लस्स्य् च्रोस्सोवेर् फ़िल्म् कर्ने अमेरिच गये ,aur tum koi classy crossover film karne America gaye
roseshnayadon.wmv,rosesh,america?,surprise,america,अमेरिच?,America?
roseshnayadon.wmv,sahil,kyun mera award lene tum mere saath america nahi aaoge ,neutral,kyun mera award lene tum mere saath america nahi aaoge,क्युन् मेर अवर्द् लेने तुम् मेरे साथ् अमेरिच नहि आओगे ,Why don't you come with me to America to take my award?
roseshnayadon.wmv,maya,oh that's so nice ,joy,oh nice,ओह् थत्'स् सो निचे ,oh that's so nice
roseshnayadon.wmv,monisha,bhai ho toh aise ,joy,bhai ho toh aise,भै हो तोह् ऐसे ,brother are you like this?
roseshnayadon.wmv,maya,can we say sweet and special siblings or blood brothers. ye bhai ho toh aise is just so middle class monisha ,disgust,say sweet special sibling blood brother ye bhai ho toh aise middle class monisha,चन् वे सय् स्वीत् अन्द् स्पेचिअल् सिब्लिन्ग्स् ओर् ब्लूद् ब्रोथेर्स्। ये भै हो तोह् ऐसे इस् जुस्त् सो मिद्द्ले च्लस्स् मोनिश ,can we say sweet and special siblings or blood brothers. ye bhai ho toh aise is just so middle class monisha
roseshnayadon.wmv,madhusudan,hein,neutral,hein,हेइन्,hein
roseshnayadon.wmv,rosesh,huhuhuhu,joy,huhuhuhu,हुहुहुहु,huhuhuhu
roseshmarriesrita.wmw,maya,haan sarita bataya main usse are rosesh to ajanta ka naam sunte hi ucchal pada ,joy,haan sarita bataya main usse rosesh ajanta ka naam sunte hi ucchal pada,हान् सरित बतय मैन् उस्से अरे रोसेश् तो अजन्त क नाम् सुन्ते हि उच्चल् पद ,I told Sarita that I am angry and I heard the name of the agent.
roseshmarriesrita.wmw,monisha,ladki ka naam ajanta kyon rakha,neutral,ladki ka naam ajanta kyon rakha,लद्कि क नाम् अजन्त क्योन् रख,Why did you keep the girl's name Ajanta?
roseshmarriesrita.wmw,indravadan,kyunki uski maa ajanta caves dekh rahi thi jab vo paida hui haha,joy,kyunki uski maa ajanta cave dekh rahi thi jab vo paida hui haha,क्युन्कि उस्कि मा अजन्त चवेस् देख् रहि थि जब् वो पैद हुइ हह,because her mother kept looking at the caves when she was born haha
roseshmarriesrita.wmw,sahil,sochiye dad agar qutub minar dekh rahi hogi,neutral,sochiye dad agar qutub minar dekh rahi hogi,सोचिये दद् अगर् क़ुतुब् मिनर् देख् रहि होगि,"Dad, imagine if you would have seen Qutub Minar."
roseshmarriesrita.wmw,indravadan,are tu kitna interesting wedding card banta rosesh ka rosesh weds qutub minar haha,joy,tu kitna interesting wedding card banta rosesh ka rosesh wed qutub minar haha,अरे तु कित्न इन्तेरेस्तिन्ग् वेद्दिन्ग् चर्द् बन्त रोसेश् क रोसेश् वेद्स् क़ुतुब् मिनर् हह,are tu kitna interesting wedding card banta rosesh ka rosesh weds qutub minar haha
roseshmarriesrita.wmw,rosesh,very funny ,contempt,funny,वेर्य् फ़ुन्न्य् ,very funny
roseshmarriesrita.wmw,maya,nahin nahin come on main kisi ko nahin bataungi how can i do that i will talk to you later,neutral,nahin nahin come main kisi ko nahin bataungi talk later,नहिन् नहिन् चोमे ओन् मैन् किसि को नहिन् बतौन्गि होव् चन् इ दो थत् इ विल्ल् तल्क् तो योउ लतेर्,nahin nahin come on main kisi ko nahin bataungi how can i do that i will talk to you later
roseshmarriesrita.wmw,maya,ok everybody apne ghar mein confession day banate hue ab ek dusre ko ek dusre se chhupaya vah koi sach bataen pahle ek baat sun lo monisha,neutral,ok everybody apne ghar mein confession day banate hue ab ek dusre ko ek dusre se chhupaya vah koi sach bataen pahle ek baat sun lo monisha,ओक् एवेर्य्बोद्य् अप्ने घर् मेइन् चोन्फ़ेस्सिओन् दय् बनते हुए अब् एक् दुस्रे को एक् दुस्रे से छुपय वह् कोइ सच् बतएन् पह्ले एक् बात् सुन् लो मोनिश,"Ok everybody has made confession day in your house, now one has kissed another one, tell me the truth, first listen to me Monisha."
roseshmarriesrita.wmw,monisha,kya ,neutral,kya,क्य ,kya
roseshmarriesrita.wmw,maya,sach ko lekar koi argument koi jhagada nahin hoga ok?,neutral,sach ko lekar koi argument koi jhagada nahin hoga ok,सच् को लेकर् कोइ अर्गुमेन्त् कोइ झगद नहिन् होग ओक्?,"No doctor will make any argument about the truth, ok?"
roseshmarriesrita.wmw,rosesh,ok,neutral,ok,ओक्,ok
roseshmarriesrita.wmw,maya,good,neutral,good,गूद्,good
roseshmarriesrita.wmw,maya,indu pata hai abhi sarita ne kitna bada confession kia,neutral,indu pata hai abhi sarita ne kitna bada confession kia,इन्दु पत है अभि सरित ने कित्न बद चोन्फ़ेस्सिओन् किअ,I just found out what a big confession Sarita made.
roseshmarriesrita.wmw,indravadan,kya,neutral,kya,क्य,kya
roseshmarriesrita.wmw,maya,jab vo choti thi aur nimbu churaya karti thi,contempt,jab vo choti thi aur nimbu churaya karti thi,जब् वो चोति थि और् निम्बु चुरय कर्ति थि,when she ate and she stole lemons
roseshmarriesrita.wmw,monisha,nimbu churane main bada confession kya hai ,neutral,nimbu churane main bada confession kya hai,निम्बु चुरने मैन् बद चोन्फ़ेस्सिओन् क्य है ,What is the big confession in lemon stealing?
roseshmarriesrita.wmw,indravadan,wo bade nimbu churati hogi haha,joy,wo bade nimbu churati hogi haha,वो बदे निम्बु चुरति होगि हह,those bad lemons will be stolen haha
roseshmarriesrita.wmw,sahil,kisi aur ke confession ko lekar lambi charcha yatra nikale apna confession start karen mom we will start with you,neutral,kisi aur ke confession ko lekar lambi charcha yatra nikale apna confession start karen mom start,किसि और् के चोन्फ़ेस्सिओन् को लेकर् लम्बि चर्च यत्र निकले अप्न चोन्फ़ेस्सिओन् स्तर्त् करेन् मोम् वे विल्ल् स्तर्त् विथ् योउ,"To find someone else's confession, take a long journey and start your confession, mom, we will start with you."
roseshmarriesrita.wmw,maya,me,neutral,,मे,me
roseshmarriesrita.wmw,sahil,hmm,neutral,hmm,ह्म्म्,hmmm
roseshmarriesrita.wmw,maya,haha ok,joy,haha ok,हह ओक्,haha okay
