episode,speakers,utterances,emotions,cleaned_utterances,hindi_utterances,english_utterances
roseshantstobeadopted.wmv,good rosesh,ye kya kar raha hai rosesh? bharat tera desh! bhartiya insan hai saccha. kisi ka khat padhna nahin hai achcha.,neutral,ye kya kar raha hai rosesh bharat tera desh bhartiya insan hai saccha kisi ka khat padhna nahin hai achcha,ये क्य कर् रह है रोसेश्? भरत् तेर देश्! भर्तिय इन्सन् है सच्च। किसि क खत् पध्न नहिन् है अच्च।,What are you doing Rosesh? India is your country! Bhartiya is a true human being. It is better not to read anyone's letter.
roseshantstobeadopted.wmv,bad rosesh,"hahaha khat padh le rosesh baby or padhne de hamen bhi. kitna achcha lagta hai balon mein gel, ding dong bell.",neutral,hahaha khat padh le rosesh baby padhne de haman bhi kitna achcha lagta hai balon mein gel ding dong bell,"हहह खत् पध् ले रोसेश् बब्य् ओर् पध्ने दे हमेन् भि। कित्न अच्च लग्त है बलोन् मेइन् गेल्, दिन्ग् दोन्ग् बेल्ल्।","hahaha read the book rosesh baby or read the book also. How nice looks the gel in the balloon, ding dong bell."
roseshantstobeadopted.wmv,good rosesh,"kavita acchi hai lekin khayal achcha nahin hai, villain rosesh. momma ne kaha hai kisi aur ka khat padhna galat baat hai",neutral,kavita acchi hai lekin khayal achcha nahin hai villain rosesh momma ne kaha hai kisi aur ka khat padhna galat baat hai,"कवित अच्चि है लेकिन् खयल् अच्च नहिन् है, विल्लैन् रोसेश्। मोम्म ने कह है किसि और् क खत् पध्न गलत् बात् है","Poetry is good but thought is not good, villain Rosesh. Momma said it is wrong to read someone else's letter."
roseshantstobeadopted.wmv,bad rosesh,"galat hai, par momma ne tumse kaha tha ki do bar brush karna aur tumne sirf ek bar kiya tha kya vah galat nahin tha?",contempt,galat hai par momma ne tumse kaha tha ki bar brush karna aur tumne sirf ek bar kiya tha kya vah galat nahin tha,"गलत् है, पर् मोम्म ने तुम्से कह थ कि दो बर् ब्रुश् कर्न और् तुम्ने सिर्फ़् एक् बर् किय थ क्य वह् गलत् नहिन् थ?","It's wrong, but mom told you to brush twice and you only did it once, wasn't that wrong?"
roseshantstobeadopted.wmv,good rosesh,galat tha per,neutral,galat tha per,गलत् थ पेर्,galat tha per
roseshantstobeadopted.wmv,bad rosesh,momma ne tumse jab green chatni mangi thi aur tumne red pass ki thi kya vah galat nahin tha?,contempt,momma ne tumse jab green chatni mangi thi aur tumne red pas ki thi kya vah galat nahin tha,मोम्म ने तुम्से जब् ग्रीन् चत्नि मन्गि थि और् तुम्ने रेद् पस्स् कि थि क्य वह् गलत् नहिन् थ?,Wasn't it wrong when momma asked you for green chatni and you passed red?
roseshantstobeadopted.wmv,good rosesh,wo to galat tha,neutral,wo galat tha,वो तो गलत् थ,wo to galat tha
roseshantstobeadopted.wmv,bad rosesh,pichhle sal momma ki nayi hair style ostrich jesi thi aur tumne unhen apsara kaha tha kya vah galat nahin tha?,contempt,pichhle sal momma ki nayi hair style ostrich jesi thi aur tumne unhen apsara kaha tha kya vah galat nahin tha,पिछ्ले सल् मोम्म कि नयि हैर् स्त्य्ले ओस्त्रिच् जेसि थि और् तुम्ने उन्हेन् अप्सर कह थ क्य वह् गलत् नहिन् थ?,"Last year mom's new hair style was like an ostrich and you called her a nymph, wasn't that wrong?"
roseshantstobeadopted.wmv,good rosesh,han tha tha tha!,neutral,han tha tha tha,हन् थ थ थ!,han tha tha tha!
roseshantstobeadopted.wmv,rosesh,"please please please, tum log jara sophisticated argument karo na varna momma kahenge ki meri antaratma bahut middle class hai. tum log decide kar lo tab tak main yah lifafa khol ke padh leta hun.",neutral,please please please tum log jara sophisticated argument karo na varna momma kahenge ki meri antaratma bahut middle class hai tum log decide kar lo tab tak main yah lifafa khol ke padh leta hun,"प्लेअसे प्लेअसे प्लेअसे, तुम् लोग् जर सोफिस्तिचतेद् अर्गुमेन्त् करो न वर्न मोम्म कहेन्गे कि मेरि अन्तरत्म बहुत् मिद्द्ले च्लस्स् है। तुम् लोग् देचिदे कर् लो तब् तक् मैन् यह् लिफ़फ़ खोल् के पध् लेत हुन्।","Please please please, please log in with sophisticated argument otherwise mom will say that I am very middle class. You decide then I will open this envelope and read it."
roseshantstobeadopted.wmv,rosesh,"""my darling husband indravadan"" yah to momma ki handwriting hai...",neutral,darling husband indravadan yah momma ki handwriting hai,"""म्य् दर्लिन्ग् हुस्बन्द् इन्द्रवदन्"" यह् तो मोम्म कि हन्द्व्रितिन्ग् है॥।","""my darling husband indravadan"" this is momma's handwriting..."
roseshantstobeadopted.wmv,maya,"darling i know ki ham do hamare do is so middle class. isiliye to humne teesra bachcha plan kiya tha haina? lekin present circumstances ko dekh ke i am not so sure. is topic pe main tumse baat nahin kar sakti isiliye khat likh rahi hun, but kya hamen sachmuch mein yah teesra baccha. i am so confused indravadan",sadness,darling know ki ham hamare middle class isiliye humne teesra bachcha plan kiya tha haina lekin present circumstance ko dekh ke sure topic pe main tumse baat nahin kar sakti isiliye khat likh rahi hun kya haman sachmuch mein yah teesra baccha confused indravadan,"दर्लिन्ग् इ क्नोव् कि हम् दो हमरे दो इस् सो मिद्द्ले च्लस्स्। इसिलिये तो हुम्ने तीस्र बच्च प्लन् किय थ हैन? लेकिन् प्रेसेन्त् चिर्चुम्स्तन्चेस् को देख् के इ अम् नोत् सो सुरे। इस् तोपिच् पे मैन् तुम्से बात् नहिन् कर् सक्ति इसिलिये खत् लिख् रहि हुन्, बुत् क्य हमेन् सच्मुच् मेइन् यह् तीस्र बच्च। इ अम् सो चोन्फ़ुसेद् इन्द्रवदन्","darling i know what we do, what we do is so middle class. That's why we have planned our third child? But looking at the present circumstances I am not so sure. I can't talk to you mainly about this topic, that's why I am writing this letter, but what am I really like, this third child. i am so confused indravadan"
roseshantstobeadopted.wmv,rosesh,momma...,sadness,momma,मोम्म॥।,Mom...
video1.wmv,kismi,excuse me,neutral,excuse,एक्ष्चुसे मे,excuse me
video1.wmv,rosesh,kaun hai kaun hai?,fear,kaun hai kaun hai,कौन् है कौन् है?,who is who?
video1.wmv,kismi,mai kismi,neutral,mai kismi,मै किस्मि,my variety
video1.wmv,rosesh,kis meethi raat gaye,neutral,ki meethi raat gaye,किस् मीथि रात् गये,what a sweet night it was
video1.wmv,kismi,han vah sorry aapko disturb kiya so rahe the aap,neutral,han vah sorry aapko disturb kiya rahe aap,हन् वह् सोर्र्य् आप्को दिस्तुर्ब् किय सो रहे थे आप्,han vaah sorry aapko kiya so stay the aap
video1.wmv,rosesh,nahin bus thodi si nind aa gai thi. sorry han ,joy,nahin bus thodi si nind aa gai thi sorry han,नहिन् बुस् थोदि सि निन्द् आ गै थि। सोर्र्य् हन् ,Nothing but a little sleep and I fell asleep. sorry han
video1.wmv,kismi,sorry kya. baje raat ke 3:30 baje hain. sabko hi nind aati hai. bus mujhe hi nind nahin aati hai,sadness,sorry kya baje raat ke baje hain sabko hi nind aati hai bus mujhe hi nind nahin aati hai,सोर्र्य् क्य। बजे रात् के ३:३० बजे हैन्। सब्को हि निन्द् आति है। बुस् मुझे हि निन्द् नहिन् आति है,sorry what? It's 3:30 in the night. Everyone is sleeping. I just can't sleep
video1.wmv,rosesh,kismi don't cry. try counting sheep,neutral,kismi cry try counting sheep,किस्मि दोन्'त् च्र्य्। त्र्य् चोउन्तिन्ग् शीप्,kismi don't cry. try counting sheep
video1.wmv,kismi,kya?,neutral,kya,क्य?,what?
video1.wmv,rosesh,man mein bed bakriyan gino,neutral,man mein bed bakriyan gino,मन् मेइन् बेद् बक्रियन् गिनो,man mein bed bakriyan gino
video1.wmv,kismi,"ab tak 16,824 bed bakri gin chauki mein. apne jaitpur gaon ki",sadness,ab tak bed bakri gin chauki mein apne jaitpur gaon ki,"अब् तक् १६,८२४ बेद् बक्रि गिन् चौकि मेइन्। अप्ने जैत्पुर् गओन् कि","Till now 16,824 beds have been opened in Chauki. of my jaitpur village"
video1.wmv,rosesh,toh?,neutral,toh,तोह्?,toh?
video1.wmv,kismi,toh octroi wale aaye mere man mein sawal karne lage. itni sari bade bakriyan lai ho to unka octroi kyon nahin bhara,neutral,toh octroi wale aaye mere man mein sawal karne lage itni sari bade bakriyan lai ho unka octroi kyon nahin bhara,तोह् ओच्त्रोइ वले आये मेरे मन् मेइन् सवल् कर्ने लगे। इत्नि सरि बदे बक्रियन् लै हो तो उन्क ओच्त्रोइ क्योन् नहिन् भर,"Those octroi eyes started making me question my mind. You have brought so many bad baked goods to your octroi, why not?"
video1.wmv,rosesh,kismi mujhe lagta hai ki tum jyada hi imaginative ho,joy,kismi mujhe lagta hai ki tum jyada hi imaginative ho,किस्मि मुझे लग्त है कि तुम् ज्यद हि इमगिनतिवे हो,somehow I think you are more imaginative
video1.wmv,kismi,nahin re nahin imaginative hoti to train ki dhad dhad imagine nahin kar leti main. mujhe na train ki awaaz sunkar hi sone ki aadat hai. aapko koi aisi aadat hai,neutral,nahin nahin imaginative hoti train ki dhad dhad imagine nahin kar leti main mujhe na train ki awaaz sunkar hi sone ki aadat hai aapko koi aisi aadat hai,नहिन् रे नहिन् इमगिनतिवे होति तो त्रैन् कि धद् धद् इमगिने नहिन् कर् लेति मैन्। मुझे न त्रैन् कि अवाज़् सुन्कर् हि सोने कि आदत् है। आप्को कोइ ऐसि आदत् है,"There is no need to be imaginative to train, no one can even imagine. I have a habit of falling asleep listening to the sound of the train. Do you have such a habit?"
video1.wmv,rosesh,bahut pahle ek buri aadat ki,neutral,bahut pahle ek buri aadat ki,बहुत् पह्ले एक् बुरि आदत् कि,committed a bad habit long ago
video1.wmv,kismi,kya?,neutral,kya,क्य?,what?
video1.wmv,rosesh,angutha chusne ki,neutral,angutha chusne ki,अन्गुथ चुस्ने कि,thumb sucking
video1.wmv,kismi,angutha chusne ki aadat buri kaise hovi?,surprise,angutha chusne ki aadat buri kaise hovi,अन्गुथ चुस्ने कि आदत् बुरि कैसे होवि?,How to get rid of the habit of thumb sucking?
video1.wmv,rosesh,pair ka,neutral,pair ka,पैर् क,pair of
video1.wmv,kismi,ahan,neutral,ahan,अहन्,ahan
video1.wmv,rosesh,pair ulta karke i'll show you. yeh aese. aaaa. aaaa,sadness,pair ulta karke show yeh aese aaaa aaaa,पैर् उल्त कर्के इ'ल्ल् शोव् योउ। येह् अएसे। आआ। आआ,Pair reversely I'll show you. this is this. aaa. aaa
video1.wmv,kismi,kya hua rosesh kya hua?,fear,kya hua rosesh kya hua,क्य हुअ रोसेश् क्य हुअ?,what happened rosesh what happened?
video1.wmv,rosesh,nass pe nass chad gayi! my back,sadness,na pe na chad gayi back,नस्स् पे नस्स् चद् गयि! म्य् बच्क्,Nass on Nass Chad Gayi! my back
video1.wmv,kismi,ek minute ek minute. hilna mat hilna mat hilna mat. ruko ruko. yeh yah yahan dukh raha hai,neutral,ek minute ek minute hilna mat hilna mat hilna mat ruko ruko yeh yah yahan dukh raha hai,एक् मिनुते एक् मिनुते। हिल्न मत् हिल्न मत् हिल्न मत्। रुको रुको। येह् यह् यहन् दुख् रह है,One minute one minute. moving the mat moving the mat moving the mat. wait wait. it's sad here
video1.wmv,rosesh,momma,sadness,momma,मोम्म,momma
video1.wmv,kismi,shhh. shanti shanti ek minute 1 2 3,neutral,shhh shanti shanti ek minute,ष्ह्। शन्ति शन्ति एक् मिनुते १ २ ३,shhh. peace peace one minute 1 2 3
video1.wmv,rosesh,dard chala gaya kismi,joy,dard chala gaya kismi,दर्द् चल गय किस्मि,kind of pain
video1.wmv,kismi,han,joy,han,हन्,han
video1.wmv,rosesh,you are amazing,joy,amazing,योउ अरे अमज़िन्ग्,you are amazing
video1.wmv,kismi,vah kya hai na mere mama ki na cycle repair karne ki dukaan hai,joy,vah kya hai na mere mama ki na cycle repair karne ki dukaan hai,वह् क्य है न मेरे मम कि न च्य्च्ले रेपैर् कर्ने कि दुकान् है,What is there? My mother has a cycle repair shop.
video1.wmv,rosesh,toh?,neutral,toh,तोह्?,toh?
video1.wmv,kismi,vah side mein ka bhi karte hain. hadiya jodne ka bhi aata hai unhen,neutral,vah side mein ka bhi karte hain hadiya jodne ka bhi aata hai unhen,वह् सिदे मेइन् क भि कर्ते हैन्। हदिय जोद्ने क भि आत है उन्हेन्,They do it on that side too. He has also come to give a gift.
video1.wmv,rosesh,ok,neutral,ok,ओक्,ok
video1.wmv,kismi,unse sikha maine,joy,unse sikha maine,उन्से सिख मैने,I learned from him
video1.wmv,rosesh,really?,joy,really,रेअल्ल्य्?,really?
video1.wmv,kismi,han chaluth hai re. good night ,neutral,han chaluth hai good night,हन् चलुथ् है रे। गूद् निघ्त् ,han chalu hai re. good night
video1.wmv,rosesh,kismi kismi. baitho na tumhen gehri neend sona hai na,neutral,kismi kismi baitho na tumhen gehri neend sona hai na,किस्मि किस्मि। बैथो न तुम्हेन् गेह्रि नीन्द् सोन है न,"different types. I am sitting in your deep sleep, isn't it?"
video1.wmv,kismi,haan,sadness,haan,हान्,haan
video1.wmv,rosesh,tumhen main apne natak ka dialogue sunao?,neutral,tumhen main apne natak ka dialogue sunao,तुम्हेन् मैन् अप्ने नतक् क दिअलोगुए सुनओ?,Can you recite the dialogue of your play in your mind?
video1.wmv,kismi,tumhare natak ke dialogue sun ke log so jaate hain,neutral,tumhare natak ke dialogue sun ke log jaate hain,तुम्हरे नतक् के दिअलोगुए सुन् के लोग् सो जाते हैन्,The dialogues of your drama go like this
video1.wmv,rosesh,nahin yah ek special natak tha jismein mein train ka dabba banaa tha,neutral,nahin yah ek special natak tha jismein mein train ka dabba banaa tha,नहिन् यह् एक् स्पेचिअल् नतक् थ जिस्मेइन् मेइन् त्रैन् क दब्ब बना थ,"No, this was a special drama in which the train's box was made."
video1.wmv,kismi,train ka dabba?,neutral,train ka dabba,त्रैन् क दब्ब?,train box?
video1.wmv,rosesh,han aise aur mera dialogue tha. train noises.,joy,han aise aur mera dialogue tha train noise,हन् ऐसे और् मेर दिअलोगुए थ। त्रैन् नोइसेस्।,That's how my dialogue was. train noises.
yamraj.wmv,rosesh,oh my god yamraj uncle. mama aap night gown main corridor mein,surprise,oh god yamraj uncle mama aap night gown main corridor mein,ओह् म्य् गोद् यम्रज् उन्च्ले। मम आप् निघ्त् गोव्न् मैन् चोर्रिदोर् मेइन्,oh my god yamraj uncle. mama your night gown main corridor mein
yamraj.wmv,maya,o just forget about it. indu indu,fear,forget indu indu,ओ जुस्त् फ़ोर्गेत् अबोउत् इत्। इन्दु इन्दु,o just forget about it. indu indu
yamraj.wmv,rosesh,mom dad ki pulse nahi hai. dad gaye,sadness,mom dad ki pulse nahi hai dad gaye,मोम् दद् कि पुल्से नहि है। दद् गये,Mom and Dad have no pulse. dad gaye
yamraj.wmv,maya,what rubbish yamraj ji e aap abhi ke abhi isse zinda karo come on,anger,rubbish yamraj ji e aap abhi ke abhi isse zinda karo come,व्हत् रुब्बिश् यम्रज् जि ए आप् अभि के अभि इस्से ज़िन्द करो चोमे ओन्,What rubbish Yamraj ji you are keeping alive now?
yamraj.wmv,yamraj,vah re kalyug ki savitri. mein chalta hun,contempt,vah kalyug ki savitri mein chalta hun,वह् रे कल्युग् कि सवित्रि। मेइन् चल्त हुन्,There she is Kalyug's savitri. I am walking
yamraj.wmv,maya,nahin nahin nahin please rukiye. please mere pati ko wapas jinda kar dijiye please,sadness,nahin nahin nahin please rukiye please mere pati ko wapas jinda kar dijiye please,नहिन् नहिन् नहिन् प्लेअसे रुकिये। प्लेअसे मेरे पति को वपस् जिन्द कर् दिजिये प्लेअसे,No no no no no please stop. please bring my husband back alive please
yamraj.wmv,yamraj,uske alava dusra kuch mangi hai maya. aur han so santan chahie vah wali trick nahin mat aajmana,neutral,uske alava dusra kuch mangi hai maya aur han santan chahie vah wali trick nahin mat aajmana,उस्के अलव दुस्र कुच् मन्गि है मय। और् हन् सो सन्तन् चहिए वह् वलि त्रिच्क् नहिन् मत् आज्मन,"Apart from that, Maya has asked for something else. And why don't you want a child?"
yamraj.wmv,indravardhan,are nahin yamraj ji wo aisi koi chij mange bhi na to kabhi tathasthu hargiz mat kahan. agar 100 rosesh paida ho gaye to hamara kya hoga,fear,nahin yamraj ji wo aisi koi chij mange bhi na kabhi tathasthu hargiz mat kahan agar rosesh paida ho gaye hamara kya hoga,अरे नहिन् यम्रज् जि वो ऐसि कोइ चिज् मन्गे भि न तो कभि तथस्थु हर्गिज़् मत् कहन्। अगर् १०० रोसेश् पैद हो गये तो हमर क्य होग,"There is no Yamraj ji, even if he asks for something like this, he will never say anything to you. What will happen to us if 100 roses are paid?"
yamraj.wmv,maya,o just shut up yah waqt hai joke karne ka. hello indravardhan,contempt,shut yah waqt hai joke karne ka hello indravardhan,ओ जुस्त् शुत् उप् यह् वक़्त् है जोके कर्ने क। हेल्लो इन्द्रवर्धन्,o just shut up this is the time to joke. hello indravardhan
yamraj.wmv,everyone,everyone sings,joy,everyone sings,एवेर्योने सिन्ग्स्,everybody sings
yamraj.wmv,maya,yah sab tum logon ka natak tha mujhe pahle se hi pata tha,neutral,yah sab tum logon ka natak tha mujhe pahle se hi pata tha,यह् सब् तुम् लोगोन् क नतक् थ मुझे पह्ले से हि पत थ,I already knew that this was all a drama of you guys.
yamraj.wmv,indravardhan,abhi thodi der pahle tu ro rahi thi. sahil maine kaha tha na ham donon ke bich mein koi bhi problem ho lekin waqt aane per yah mere liye sati savitri jarur banegi,joy,abhi thodi der pahle tu ro rahi thi sahil maine kaha tha na ham donon ke bich mein koi bhi problem ho lekin waqt aane per yah mere liye sati savitri jarur banegi,अभि थोदि देर् पह्ले तु रो रहि थि। सहिल् मैने कह थ न हम् दोनोन् के बिच् मेइन् कोइ भि प्रोब्लेम् हो लेकिन् वक़्त् आने पेर् यह् मेरे लिये सति सवित्रि जरुर् बनेगि,"Just a little while ago you were crying. Sahil said that there will be no problem between us but when the time comes, Sati Savitri will definitely be made for me."
yamraj.wmv,rosesh,and momma meet him this is ramesh shirke stage actor,joy,momma meet ramesh shirke stage actor,अन्द् मोम्म मीत् हिम् थिस् इस् रमेश् शिर्के स्तगे अच्तोर्,and momma meet him this is ramesh shirke stage actor
yamraj.wmv,yamraj,hello,joy,hello,हेल्लो,Hello
yamraj.wmv,maya,i hate him.,joy,hate,इ हते हिम्।,i hate him.
yamraj.wmv,monisha,mummy ji yah ine sab ki mili bhagat thi,joy,mummy ji yah ine sab ki mili bhagat thi,मुम्म्य् जि यह् इने सब् कि मिलि भगत् थि,Mummy ji is the one who met everyone.
yamraj.wmv,indravardhan,han taki wedding anniversary ki party se pahle thoda maja a jaaye,joy,han taki wedding anniversary ki party se pahle thoda maja jaaye,हन् तकि वेद्दिन्ग् अन्निवेर्सर्य् कि पर्त्य् से पह्ले थोद मज अ जाये,Why don't you have some fun before the wedding anniversary party?
yamraj.wmv,sahil,i'm sorry mum. i love you.,joy,sorry mum love,इ'म् सोर्र्य् मुम्। इ लोवे योउ।,I'm sorry mom. i love you.
yamraj.wmv,monisha,mummy ji pata hai shirke sab ne muft mein acting ki. sirf unki costume ke 300 rupaye lage uska aadha ham de denge,joy,mummy ji pata hai shirke sab ne muft mein acting ki sirf unki costume ke rupaye lage uska aadha ham de denge,मुम्म्य् जि पत है शिर्के सब् ने मुफ़्त् मेइन् अच्तिन्ग् कि। सिर्फ़् उन्कि चोस्तुमे के ३०० रुपये लगे उस्क आध हम् दे देन्गे,Mummy has learned that everyone acted for free. Only 300 rupees for his costume will cost him half of my money.
yamraj.wmv,maya,monisha please.,contempt,monisha please,मोनिश प्लेअसे।,monisha please.
finale.avi,sahil,mr. sindolin ghar mein matlab hamare parivar ke sath 7 sal bad kabhi kuchh achcha bhi hoga? i mean thoda sa,contempt,sindolin ghar mein matlab hamare parivar ke sath sal bad kabhi kuchh achcha bhi hoga mean thoda sa,म्र्। सिन्दोलिन् घर् मेइन् मत्लब् हमरे परिवर् के सथ् ७ सल् बद् कभि कुछ् अच्च भि होग? इ मेअन् थोद स,"mr. Sindolin ghar mein meaning, will anything good ever happen with our family after 7 years? i mean a little bit"
