episode,speakers,utterances,emotions,cleaned_utterances,hindi_utterances,english_utterances
roseshaccident,madhusudhan,"""yah monisha ji hi rosesh ko girftar karane ayi hain."" na na be. monisha ji yah to mera bhatija hai",joy,yah monisha ji hi rosesh ko girftar karane ayi hain na na monisha ji yah mera bhatija hai,"""यह् मोनिश जि हि रोसेश् को गिर्फ़्तर् करने अयि हैन्।"" न न बे। मोनिश जि यह् तो मेर भतिज है","""Yes Monisha ji is here to arrest Rosesh."" na na be. monisha ji this is my nephew"
roseshaccident,monisha,saga bhatija?,surprise,saga bhatija,सग भतिज?,Saga Bhatija?
roseshaccident,madhusudhan,maaf kar dijiye galti ho jaati hai inspector sahab chhod dijiye ise,neutral,maaf kar dijiye galti ho jaati hai inspector sahab chhod dijiye ise,माफ़् कर् दिजिये गल्ति हो जाति है इन्स्पेच्तोर् सहब् छोद् दिजिये इसे,Please forgive me if it is a mistake Inspector Sahab please leave it
roseshaccident,inspector,well per yah madam zidd pe adi hui hai,fear,well per yah madam zidd pe adi hui hai,वेल्ल् पेर् यह् मदम् ज़िद्द् पे अदि हुइ है,well for this madam is adamant
roseshaccident,madhusudhan,"nahin nahin yah to hamesha simple saree pahnati hain. monisha ji, inspector ko kah dijiye na ki ise chhod de.",neutral,nahin nahin yah hamesha simple saree pahnati hain monisha ji inspector ko kah dijiye na ki ise chhod de,"नहिन् नहिन् यह् तो हमेश सिम्प्ले सरी पह्नति हैन्। मोनिश जि, इन्स्पेच्तोर् को कह् दिजिये न कि इसे छोद् दे।","No no she always wears simple saree. Monisha ji, please tell the inspector why he left it."
roseshaccident,maya,ham log apologize kar rahe hain. go on say sorry.,neutral,ham log apologize kar rahe hain go say sorry,हम् लोग् अपोलोगिज़े कर् रहे हैन्। गो ओन् सय् सोर्र्य्।,We are trying to apologize. go on say sorry.
roseshaccident,rosesh,i am very sorry,neutral,sorry,इ अम् वेर्य् सोर्र्य्,i am very sorry
roseshaccident,monisha,theek hai ab jab madhu bhai keh hi rahe hain to maine ise chhor diya.,joy,theek hai ab jab madhu bhai keh hi rahe hain maine ise chhor diya,थीक् है अब् जब् मधु भै केह् हि रहे हैन् तो मैने इसे छोर् दिय।,"When Madhu Bhai said he is here, I asked him to leave."
roseshaccident,sahil,madhusudan fufa aaj pahli bar aap kam aaye hain,joy,madhusudan fufa aaj pahli bar aap kam aaye hain,मधुसुदन् फ़ुफ़ आज् पह्लि बर् आप् कम् आये हैन्,madhusudan uncle today for the first time you have come less
african,sahil,hi monisha,neutral,hi monisha,हि मोनिश,hi monisha
african,monisha,hi sahil,neutral,hi sahil,हि सहिल्,hi shore
african,sahil,maine tumse kitni bar kaha hai fir bhi tum vada pav kha rahi ho na,neutral,maine tumse kitni bar kaha hai fir bhi tum vada pav kha rahi ho na,मैने तुम्से कित्नि बर् कह है फ़िर् भि तुम् वद पव् ख रहि हो न,"I have told you so many times, yet you are still eating vada pav."
african,monisha,sahil ! sahil! sahil!... soch samajh ke bolna... tum jo kahoge vah sach ho jaega... rosesh bhaiya ne kaha hai ki vo african chant 8 ghante ke bad activate ho jaega... aur 8 ghante pure ho chuke hain sahil,fear,sahil sahil sahil soch samajh ke bolna tum jo kahoge vah sach ho jaega rosesh bhaiya ne kaha hai ki vo african chant ghante ke bad activate ho jaega aur ghante pure ho chuke hain sahil,सहिल् ! सहिल्! सहिल्!॥। सोच् समझ् के बोल्न॥। तुम् जो कहोगे वह् सच् हो जएग॥। रोसेश् भैय ने कह है कि वो अफ़्रिचन् चन्त् ८ घन्ते के बद् अच्तिवते हो जएग॥। और् ८ घन्ते पुरे हो चुके हैन् सहिल्,shore! shore! Sahil!... soch samaj ke bona... whatever you say will come true... rosesh bhaiya has said that that african chant will be activated after 8 hours... and 8 hours have passed now sahil
african,sahil,monisha... iska matlab ab dushyant ab gadha ban chuka hai... hehe,joy,monisha iska matlab ab dushyant ab gadha ban chuka hai hehe,मोनिश॥। इस्क मत्लब् अब् दुश्यन्त् अब् गध बन् चुक है॥। हेहे,monisha...its meaning is that dushyant has become a donkey...hehe
african,monisha,rrosesh bhaiya vahi to dekhne gaye hain,neutral,rrosesh bhaiya vahi dekhne gaye hain,र्रोसेश् भैय वहि तो देख्ने गये हैन्,Rosesh Bhaiya is there to see.
african,sahil,monisha...agar vo chant work kar raha hai na... to abhi isi waqt dad ke piche... teen (3)... teen (3)... madhu fufa... indu.. indu.. karte hue... is darwaje se andar aaenge... agar wo chant work kar raha hai to,neutral,monisha agar vo chant work kar raha hai na abhi isi waqt dad ke piche teen teen madhu fufa indu indu karte hue darwaje se andar aaenge agar wo chant work kar raha hai,मोनिश॥ऽगर् वो चन्त् वोर्क् कर् रह है न॥। तो अभि इसि वक़्त् दद् के पिचे॥। तीन् (३)॥। तीन् (३)॥। मधु फ़ुफ़॥। इन्दु॥ इन्दु॥ कर्ते हुए॥। इस् दर्वजे से अन्दर् आएन्गे॥। अगर् वो चन्त् वोर्क् कर् रह है तो,monisha...if you are doing that chant work...to this moment dad's pic... teen (3)... teen (3)... madhu uncle... indu.. indu.. He has done the work... he will come through the door... if he is still working.
african,monisha,sahil... tum bhi...,fear,sahil tum bhi,सहिल्॥। तुम् भि॥।,shore... you too...
african,sahil,kuch hua?,neutral,kuch hua,कुच् हुअ?,what happened?
african,indravardhan,sahil! sahil! khatam ho gaya!,sadness,sahil sahil khatam ho gaya,सहिल्! सहिल्! खतम् हो गय!,shore! shore! I have eaten!
african,madhusudan,ae indu! ae indu! ae indu!... indu,neutral,ae indu ae indu ae indu indu,अए इन्दु! अए इन्दु! अए इन्दु!॥। इन्दु,hey indu! hey indu! ae indu!... indu!
african,indravardhan,sahil... ye dekh,sadness,sahil ye dekh,सहिल्॥। ये देख्,shore...see this
african,madhusudan,kya hua? kya hua?... kitni wickets?... konsi talkies mein?,neutral,kya hua kya hua kitni wicket konsi talkie mein,क्य हुअ? क्य हुअ?॥। कित्नि विच्केत्स्?॥। कोन्सि तल्किएस् मेइन्?,what happened? kya hua?... how many wickets?... how many talkies?
african,indravardhan,sahil.. mere jani dushman... triple role mein,sadness,sahil mere jani dushman triple role mein,सहिल्॥ मेरे जनि दुश्मन्॥। त्रिप्ले रोले मेइन्,sea... my beloved enemy... triple role mein
african,indravardhan,kuch kar sahil.. nahi to mein pagal ho jaunga,fear,kuch kar sahil nahi mein pagal ho jaunga,कुच् कर् सहिल्॥ नहि तो मेइन् पगल् हो जौन्ग,"Don't worry, I will go crazy.."
african,madhusudan,hai? hai? hai?,neutral,hai hai hai,है? है? है?,hai? hai? hai?
african,indravardhan,"aray... main tum logon se kuchh kaha ki tum log ""hai hai"" kiye ja rahe ho tino",anger,aray main tum logon se kuchh kaha ki tum log hai hai kiye ja rahe ho tino,"अरय्॥। मैन् तुम् लोगोन् से कुछ् कह कि तुम् लोग् ""है है"" किये ज रहे हो तिनो","aray... I told you guys that you guys are saying ""hai hai"" and you are ho tino."
african,madhusudan,polyster? nahi.. sarojini naidu... chup kar... rajdhani express.,neutral,polyster nahi sarojini naidu chup kar rajdhani express,पोल्य्स्तेर्? नहि॥ सरोजिनि नैदु॥। चुप् कर्॥। रज्धनि एक्ष्प्रेस्स्।,polyester? No... Sarojini Naidu... shut up... Rajdhani Express.
african,indravardhan,dekha sahil... teenon ke teenon behre hai... aur apna apna andaaza laga raha hai ki maine kya kaha hoga,sadness,dekha sahil teenon ke teenon behre hai aur apna apna andaaza laga raha hai ki maine kya kaha hoga,देख सहिल्॥। तीनोन् के तीनोन् बेह्रे है॥। और् अप्न अप्न अन्दाज़ लग रह है कि मैने क्य कह होग,Look at the beach... everyone's teens are getting better... and you are wondering what I will say.
african,madhusudan,hai? hai? hai?,neutral,hai hai hai,है? है? है?,hai? hai? hai?
african,monisha,sahil... vo african chant kam karne laga,fear,sahil vo african chant kam karne laga,सहिल्॥। वो अफ़्रिचन् चन्त् कम् कर्ने लग,sahil...that african chant started to reduce
african,sahil,nahi! nahi!,fear,nahi nahi,नहि! नहि!,no! no!
african,monisha,kya nahi nahi... dekho na teen teen madhu fufa!,surprise,kya nahi nahi dekho na teen teen madhu fufa,क्य नहि नहि॥। देखो न तीन् तीन् मधु फ़ुफ़!,kya nahi nahi... look at teen teen madhu fufa!
african,sahil,this is a trick!,anger,trick,थिस् इस् अ त्रिच्क्!,this is a trick!
african,monisha,koi trick shik nahi hai sahil... dekho...,fear,koi trick shik nahi hai sahil dekho,कोइ त्रिच्क् शिक् नहि है सहिल्॥। देखो॥।,There is no trick to be learned... see...
african,sahil,chup... chup raho tum.. tum pagal ho gai ho!,anger,chup chup raho tum tum pagal ho gai ho,चुप्॥। चुप् रहो तुम्॥ तुम् पगल् हो गै हो!,shut up... shut up you... you are crazy!
african,monisha,na nana na na! nana nana na na!,joy,na nana na na nana nana na na,न नन न न! नन नन न न!,na nana na na na! nana nana na na!
african,sahil,dad.. dad.. please bataiye mein kya karu?!,fear,dad dad please bataiye mein kya karu,दद्॥ दद्॥ प्लेअसे बतैये मेइन् क्य करु?!,dad..dad..please tell me what to do?!
african,sahil,madhusudhan fufa.. dekhiye..,neutral,madhusudhan fufa dekhiye,मधुसुधन् फ़ुफ़॥ देखिये॥,Madhusudhan uncle.. see..
african,madhusudan,nahi nahi... sev puri abhi nahi... bas 2 over baki hai... aray uski tickete to black ho rahi hai...,neutral,nahi nahi sev puri abhi nahi ba baki hai aray uski tickete black ho rahi hai,नहि नहि॥। सेव् पुरि अभि नहि॥। बस् २ ओवेर् बकि है॥। अरय् उस्कि तिच्केते तो ब्लच्क् हो रहि है॥।,Nahi nahi... sev puri ahi ahi... only 2 more left... aray uski tickete to black ho ho hai...
african,indravardhan,sahil.. sahil... teenon ko gayab kar varana mein barbad ho jaunga... meri hatya ho jayegi sahil,sadness,sahil sahil teenon ko gayab kar varana mein barbad ho jaunga meri hatya ho jayegi sahil,सहिल्॥ सहिल्॥। तीनोन् को गयब् कर् वरन मेइन् बर्बद् हो जौन्ग॥। मेरि हत्य हो जयेगि सहिल्,Sahil.. Sahil... By making the teenon disappear I will be ruined in Varana... I will be murdered Sahil.
african,sahil,madhusudhan fufao... gayab ho jao!,neutral,madhusudhan fufao gayab ho jao,मधुसुधन् फ़ुफ़ओ॥। गयब् हो जओ!,madhusudhan fufao… go away!
african,sahil,gaye!... ab isko pakdo,joy,gaye ab isko pakdo,गये!॥। अब् इस्को पक्दो,Gaye!... now pack it!
african,monisha,madhu fufa gayab!... madhu fufa gayab!... madhu fufa gayab,joy,madhu fufa gayab madhu fufa gayab madhu fufa gayab,मधु फ़ुफ़ गयब्!॥। मधु फ़ुफ़ गयब्!॥। मधु फ़ुफ़ गयब्,Madhu uncle is missing!... Madhu uncle is missing!... Madhu uncle is missing.
african,indravardhan,aray aray sahil .... sahil sahil.. sun sun sun sun sahil sun... isko bhi normal bana de.. i mean pehle jaise kam paga banade please!,sadness,aray aray sahil sahil sahil sun sun sun sun sahil sun isko bhi normal bana de mean pehle jaise kam paga banade please,अरय् अरय् सहिल् ॥॥ सहिल् सहिल्॥ सुन् सुन् सुन् सुन् सहिल् सुन्॥। इस्को भि नोर्मल् बन दे॥ इ मेअन् पेह्ले जैसे कम् पग बनदे प्लेअसे!,Aray aray shore....shore shore..sun sun sun sun shore sun...make this also normal.. I mean make it less like before please!
african,sahil,monisha... pehele jaise normal banjao.,neutral,monisha pehele jaise normal banjao,मोनिश॥। पेहेले जैसे नोर्मल् बन्जओ।,monisha...dress as normal as before.
african,monisha,sahil... daddy ji.. aplke liye khane mein paneer banau?,neutral,sahil daddy ji aplke liye khane mein paneer banau,सहिल्॥। दद्द्य् जि॥ अप्ल्के लिये खने मेइन् पनीर् बनौ?,Sahil... daddy ji.. can I make paneer for you?
african,sahil,paneer our?,neutral,paneer,पनीर् ओउर्?,paneer our?
african,monisha,bas paneer,neutral,ba paneer,बस् पनीर्,bass paneer
african,sahil,hai!!!,anger,hai,है!!!,hey!!!
african,indravardhan,chaelga chalega... hum paneer aachar ke saath kha lenge ha... jao,neutral,chaelga chalega hum paneer aachar ke saath kha lenge ha jao,चएल्ग चलेग॥। हुम् पनीर् आचर् के साथ् ख लेन्गे ह॥। जओ,we will continue to eat... we will eat with paneer aachar... go!
african,monisha,okay,neutral,okay,ओकय्,okay
african,sahil,i mean.. monisha bai!!,anger,mean monisha bai,इ मेअन्॥ मोनिश बै!!,i mean.. monisha bai!!
african,indravardhan,sahil sahil... mein haat jodta hu... jo kuch bhi bolo jara soch samaz ke bolna ha.,fear,sahil sahil mein haat jodta hu jo kuch bhi bolo jara soch samaz ke bolna ha,सहिल् सहिल्॥। मेइन् हात् जोद्त हु॥। जो कुच् भि बोलो जर सोच् समज़् के बोल्न ह।,"On the shore... I am added to the heart... whatever little is said, it has to be said by the thinking society."
bachlorparty,maya,ohh... ye malvika ki vajaha re sab ga.... ,sadness,ohh ye malvika ki vajaha sab ga,ओह्ह्॥। ये मल्विक कि वजह रे सब् ग॥॥ ,"ohh...this is Malvika's need, everyone will go...."
bachlorparty,maya,hello boys... bade cute lag rahe hai aap teeno,joy,hello boy bade cute lag rahe hai aap teeno,हेल्लो बोय्स्॥। बदे चुते लग् रहे है आप् तीनो,hello boys... you are looking very cute teeno
bachlorparty,maya,aur dushyant tum... bhi,surprise,aur dushyant tum bhi,और् दुश्यन्त् तुम्॥। भि,and Dushyant you... too
bachlorparty,indravardhan,belt theek hai na?,neutral,belt theek hai na,बेल्त् थीक् है न?,Is the belt clean?
bachlorparty,dushyant,haa,neutral,haa,हा,yes
bachlorparty,monisha,sahil!!!,joy,sahil,सहिल्!!!,coast!!!
bachlorparty,sahil,ahh... haha.... hi sweetheart... how are you!.. haha..,joy,ahh haha hi sweetheart haha,अह्ह्॥। हह॥॥ हि स्वीथेअर्त्॥। होव् अरे योउ!॥ हह॥,ahh...haha....hi sweetheart...how are you!..haha..
bachlorparty,monisha,kya khel/ kar rahe the aap log,joy,kya kar rahe aap log,क्य खेल्/ कर् रहे थे आप् लोग्,kya khel/kar rahe aap log
bachlorparty,rosesh,kuch nahi... daddy dikha rahe the ki vo mujhase kitna pyaar karte hai,neutral,kuch nahi daddy dikha rahe ki vo mujhase kitna pyaar karte hai,कुच् नहि॥। दद्द्य् दिख रहे थे कि वो मुझसे कित्न प्यार् कर्ते है,Not much...daddy is showing how much he loves me
bachlorparty,maya,hahaha... to vo to 30 seconds mein khatam ho gaya hoga... fir uske baad?,contempt,hahaha vo second mein khatam ho gaya hoga fir uske baad,हहह॥। तो वो तो ३० सेचोन्द्स् मेइन् खतम् हो गय होग॥। फ़िर् उस्के बाद्?,hahaha... to that he will have eaten within 30 seconds... then after that?
bachlorparty,rosesh,aap dekhna chahati hai ki vo mujhase kitna pyaar karte hai?,neutral,aap dekhna chahati hai ki vo mujhase kitna pyaar karte hai,आप् देख्न चहति है कि वो मुझसे कित्न प्यार् कर्ते है?,Do you want to see how much he loves me?
bachlorparty,maya,definitely!,joy,definitely,देफ़िनितेल्य्!,definitely!
bachlorparty,rosesh,"daddy, mujhe pyaas lagi hai... pani?",neutral,daddy mujhe pyaas lagi hai pani,"दद्द्य्, मुझे प्यास् लगि है॥। पनि?","Daddy, I am thirsty... water?"
bachlorparty,indravardhan,ofcourse... aahh... beta sadha piyoge ya thanda... mere munna!,neutral,ofcourse aahh beta sadha piyoge ya thanda mere munna,ओफ़्चोउर्से॥। आह्ह्॥। बेत सध पियोगे य थन्द॥। मेरे मुन्न!,ofcourse... aahh... beta sadha piyoge ya thanda... mere munna!
bachlorparty,maya,unbelievable !,surprise,unbelievable,उन्बेलिएवब्ले !,unbelievable!
bachlorparty,babu,"okay boys, ab chinta karne ki koi jarurat nahi hai, maine dono ko chupa diya hai",joy,okay boy ab chinta karne ki koi jarurat nahi hai maine dono ko chupa diya hai,"ओकय् बोय्स्, अब् चिन्त कर्ने कि कोइ जरुरत् नहि है, मैने दोनो को चुप दिय है","okay boys, now there is no need to worry, I have sucked both of them"
bachlorparty,maya,hello...,neutral,hello,हेल्लो॥।,Hello...
bachlorparty,babu,hello...,neutral,hello,हेल्लो॥।,Hello...
bachlorparty,monisha,ye kon hai?,anger,ye kon hai,ये कोन् है?,who is this?
bachlorparty,indravardhan,plumber,neutral,plumber,प्लुम्बेर्,plumber
bachlorparty,maya,plumber!?... lady plumner!?... aap logonne lady plumber ko bulaya,neutral,plumber lady plumner aap logonne lady plumber ko bulaya,प्लुम्बेर्!?॥। लद्य् प्लुम्नेर्!?॥। आप् लोगोन्ने लद्य् प्लुम्बेर् को बुलय,plumber!?... lady plumner!?... aap logne lady plumber ko buaya
bachlorparty,indravardhan,maya... tumhi kehati ho na ki aurat ko har vo kaam karna chahiye jo mard kiya karte hai... isliye...,joy,maya tumhi kehati ho na ki aurat ko har vo kaam karna chahiye jo mard kiya karte hai isliye,मय॥। तुम्हि केहति हो न कि औरत् को हर् वो काम् कर्न चहिये जो मर्द् किय कर्ते है॥। इस्लिये॥।,Maya... You are saying that a woman should do the work that a man does... that's why...
bachlorparty,sahil,aa.. hum logonne yello pages mein se dhoond dhoond kar ek lady plumber ko yaha bulaya hai,neutral,aa hum logonne yello page mein se dhoond dhoond kar ek lady plumber ko yaha bulaya hai,आ॥ हुम् लोगोन्ने येल्लो पगेस् मेइन् से धून्द् धून्द् कर् एक् लद्य् प्लुम्बेर् को यह बुलय है,aa.. we searched through the yellow pages and called a lady plumber here.
bachlorparty,maya,very interesting...,neutral,interesting,वेर्य् इन्तेरेस्तिन्ग्॥।,very interesting...
bachlorparty,maya,umm.. miss.. umm.. ,neutral,umm miss umm,उम्म्॥ मिस्स्॥ उम्म्॥ ,umm.. miss.. umm..
bachlorparty,indravardhan,bhramham gachak shanika!,neutral,bhramham gachak shanika,भ्रम्हम् गचक् शनिक!,brahham gachak shanika!
bachlorparty,maya,ohh whatever... aap plumber hai?,neutral,ohh whatever aap plumber hai,ओह्ह् व्हतेवेर्॥। आप् प्लुम्बेर् है?,ohh whatever... are you a plumber?
bachlorparty,everyone,haaa!,joy,haaa,हाअ!,Haaa!
bachlorparty,maya,"aap kuch kehe rahi thi na, ki maine dono ko chupa diya... kya chupa diya aapne?",neutral,aap kuch kehe rahi thi na ki maine dono ko chupa diya kya chupa diya aapne,"आप् कुच् केहे रहि थि न, कि मैने दोनो को चुप दिय॥। क्य चुप दिय आप्ने?","Where did you go, why did I suck both of them... what did you suck?"
bachlorparty,indravardhan,"haa vo... maya, tum bhool gayi, vo bathroom mein do live wires latak rahe the, shock lagne ka dar tha.. vo wires isne chupa diye",joy,haa vo maya tum bhool gayi vo bathroom mein live wire latak rahe shock lagne ka dar tha vo wire isne chupa diye,"हा वो॥। मय, तुम् भूल् गयि, वो बथ्रूम् मेइन् दो लिवे विरेस् लतक् रहे थे, शोच्क् लग्ने क दर् थ॥ वो विरेस् इस्ने चुप दिये","Haa vo… Maya, you are a fool, you are sucking live wires in the bathroom, you are giving a shock.. you are sucking those wires."
bachlorparty,maya,achha achha... wire ko chupane ke liye tumne plumber ko bulaya.... hehehe... electrician ki to... ,joy,achha achha wire ko chupane ke liye tumne plumber ko bulaya hehehe electrician ki,अछ अछ॥। विरे को चुपने के लिये तुम्ने प्लुम्बेर् को बुलय॥॥ हेहेहे॥। एलेच्त्रिचिअन् कि तो॥। ,Achha achha... you called a plumber to clean the wire... hehehe... the electrician...
bachlorparty,indravardhan,"hum electrician ko bulane wale the maya, lekin rosesh! ",anger,hum electrician ko bulane wale maya lekin rosesh,"हुम् एलेच्त्रिचिअन् को बुलने वले थे मय, लेकिन् रोसेश्! ","We had to call the electrician, but they rose!"
bachlorparty,rosesh,daddy...,neutral,daddy,दद्द्य्॥।,daddy...
bachlorparty,indravardhan,"ne bechaare ne kaha bhi ki electrician ko bulate hai, lekin uski ek nahi mani sahil ne",sadness,ne bechaare ne kaha bhi ki electrician ko bulate hai lekin uski ek nahi mani sahil ne,"ने बेचारे ने कह भि कि एलेच्त्रिचिअन् को बुलते है, लेकिन् उस्कि एक् नहि मनि सहिल् ने","The poor guy even said to call an electrician, but he had no idea."
bachlorparty,sahil,maine!?,surprise,maine,मैने!?,maine!?
bachlorparty,indravardhan,"nahi nahi.. sahil ne kaha, ise hi bulate hai, ise sab kuch ata hai, plumbing ka kaam bhi, aur electrician ka kaam bhi, aur iski khaas dost bhi hai, behen",neutral,nahi nahi sahil ne kaha ise hi bulate hai ise sab kuch ata hai plumbing ka kaam bhi aur electrician ka kaam bhi aur iski khaas dost bhi hai behen,"नहि नहि॥ सहिल् ने कह, इसे हि बुलते है, इसे सब् कुच् अत है, प्लुम्बिन्ग् क काम् भि, और् एलेच्त्रिचिअन् क काम् भि, और् इस्कि खास् दोस्त् भि है, बेहेन्","No no.. Sahil said, this is what he calls, he has given everything, plumbing work too, and electrician work too, and he also has a special friend, sister."
bachlorparty,monisha,"sahil, ye tumhari khaas dost hai?",sadness,sahil ye tumhari khaas dost hai,"सहिल्, ये तुम्हरि खास् दोस्त् है?","Sahil, is she your special friend?"
bachlorparty,sahil,iska bhai mera khaas dost hai,neutral,iska bhai mera khaas dost hai,इस्क भै मेर खास् दोस्त् है,his brother is my special friend
