episode,speakers,utterances,emotions
prankonindravadhan,sahil,"oh my god, inki pulse hi nhi hai. mom he is... he is dead",fear
prankonindravadhan,maya,dead,surprise
prankonindravadhan,rosesh,dead,surprise
prankonindravadhan,sahil,this is a case of cardiac arrest,fear
prankonindravadhan,maya,but kese hua ye,surprise
prankonindravadhan,sahil,mujhe btaiye abhi yahan kya hua,neutral
prankonindravadhan,indu,"kuch nhi. haan, maya ne zabardast check diya dinesh ko jiski wajah se use heart attack hua or wo dhad se gir gya.",neutral
prankonindravadhan,maya,"sahil, dinesh ne ye orange drink piya or...",neutral
prankonindravadhan,sahil,orange drink,neutral
prankonindravadhan,maya,oh my god. ye drink hum me se kisi ne nhi piya sirf dinesh ne piya or ye...,surprise
prankonindravadhan,maya,indu kya tha us drink me,fear
prankonindravadhan,indu,kya mujhe kya pta mene kuch nhi milaya us drink me,fear
prankonindravadhan,sahil,"dad, heart attack drink peene ke baad hua hai",anger
prankonindravadhan,indu,"heart attack kese aa sakta hai, sahil zara barabar dekh, gas hui hogi",fear
prankonindravadhan,maya,gas hone se koi zameen pe gir jata hai,neutral
prankonindravadhan,rosesh,"haan momma, dad ko gas hota hai to hum sab ese hi girr jate hai",neutral
prankonindravadhan,sahil,"dad aap kya check kar rhe hai, dinesh uncle ki death ho chuki hai",anger
prankonindravadhan,indu,are kya bakwas kar rha hai. mujhe heartbeat clearly sunai de rhi hai,anger
prankonindravadhan,sahil,wo aapki apni hai,anger
prankonindravadhan,maya,ye kya kiya tumne indravadan,sadness
prankonindravadhan,indu,"are bhyi, mene kuch nhi kiya hai. chahe to tum log bhi ye orange juice pee ke dekhlo.",fear
prankonindravadhan,maya,"are you crazy. sahil, ab kya karenge",fear
prankonindravadhan,sahil,this is a police case mom,neutral
prankonindravadhan,maya,oh my god. agar police case ho gyi to indravadan ko to jail jana padega.,fear
prankonindravadhan,indu,are magar me ise kyun marunga bhala. haan iske sade hue joke sunke kabhi kabhi mujhe iska gala ghotne ka dil karta tha lekin...,neutral
prankonindravadhan,maya,"maza indravadan... mazak. ye tumhari mazak karne ki adat hai na, ye tumhe le dubi hai.",anger
prankonindravadhan,sahil,"dad, sara evidence aapke khilaf hai",neutral
prankonindravadhan,indu,are lekin me bakasur hun sahil,fear
prankonindravadhan,sahil,bekasur,neutral
prankonindravadhan,rosesh,"haan, bakasur rakshash ko to bheem uncle ne maar dala tha",neutral
prankonindravadhan,sahil,"pta hai, rosesh",contempt
prankonindravadhan,sahil,"dad, aapke bachne ka ek chance hai.",neutral
prankonindravadhan,indu,kya,surprise
prankonindravadhan,sahil,sarita aunty ke yahan ane se pehle dinesh uncle ki lash ko hum yahan se hata de.,neutral
prankonindravadhan,maya,"are usse kya fayda sahil, sabko pta hai ki dinesh humare ghar pe aya tha. uski gadi bhi neeche padi hui hai",sadness
prankonindravadhan,sahil,"haan to theek hai na, hum log bta denge na ki dinesh uncle ko kisi ka urgently phone aya to unhe jana pada. i mean jana pada... lekin unhone yahan pe ye manhus orange drink piya tha iska zikr koi ni karega",neutral
prankonindravadhan,maya,"oh by the way, hum dinesh ko yahan se jata hua kese dikhaenge",fear
prankonindravadhan,sahil,"me inke kapde pehen leta hun, inki gadi me beth ke chala jata hun",neutral
prankonindravadhan,rosesh,haan lekin dinesh uncle ke kapde aapko fit honge,neutral
prankonindravadhan,sahil,wo me alter kara lunga na rosesh.,contempt
prankonindravadhan,rosesh,tana kyun maar rhe ho bhai,neutral
prankonindravadhan,sahil,or ni to kya rosesh. me inke kapde pehen ke kisi fashion show me hissa lene to ni ja rha hun na,anger
prankonindravadhan,maya,"sahil, agar watchman ne tumhe neeche jate hue dekh liya to. i know, radha bai can help us. radha bai...",joy
prankonindravadhan,radha bai,ji memsahab,neutral
prankonindravadhan,maya,tum to bahadur ho na,neutral
prankonindravadhan,radha bai,monisha memsahab ki kofta curry try karti hun na kabhi kabhi.,joy
prankonindravadhan,maya,"very brave... acha suno, tumhe neeche jana hai, watchman ke sath gapshap karni hai. use busy rakhna hai. fir jab sahil baba dinesh sahab ki gadi me beth ke jaenge wahan se to zor zor se bolna ‘bye bye dinesh sahab, fir ana’ samjhi",neutral
prankonindravadhan,radha bai,hmm samjhi,joy
prankonindravadhan,monisha,mummy ji... pakode...,joy
prankonindravadhan,radha bai,pakode,neutral
prankonindravadhan,maya,tum wapas kyun aa gyi radha bai,surprise
prankonindravadhan,radha bai,"aapne hi to kaha tha, monisha memsahab jab pakode leke aaegi to...",neutral
prankonindravadhan,maya,are yahan hum ek puri lash ko rafa dafa karne ke chakkar me hai or tumhe monisha memsahab ke pakode fekne ki padi hai,anger
prankonindravadhan,monish,kya mummy ji,surprise
prankonindravadhan,maya,haan monisha wo...,neutral
prankonindravadhan,monish,"aap mere pakode fikwana chahti thi. sahil, tum kha kar dekho, kha kar dekho na",sadness
prankonindravadhan,sahil,"dinesh uncle ki barsi me khaenge, alright monisha. filhal dinesh uncle yahan par mare pade hue hai",anger
prankonindravadhan,radha bai,"are wah, pakode to apne aap gir gye",joy
prankonindravadhan,maya,ab tum jao radha bai,neutral
prankonindravadhan,radha bai,par ram ya bhut puchenge to,fear
prankonindravadhan,maya,to me keh dungi bhut taki koi gire hue pakode na khaye. jao na tum,anger
prankonindravadhan,monish,"ye sab, ye sab kya hai sahil",surprise
prankonindravadhan,sahil,"relax, relax baby. kuch nhi hua hai.",neutral
prankonindravadhan,indu,haan,neutral
prankonindravadhan,sahil,"kya hai ki ye dinesh uncle hai na, wo thode se marr gye hai. to kya hai ki inki lash ko hume, thoda sa hatana hai. warna dad jo hai na wo fass jaenge",neutral
prankonindravadhan,indu,thoda sa,neutral
prankonindravadhan,sahil,"nhi, aap pura fasenge",anger
prankonindravadhan,indu,police,fear
prankonindravadhan,maya,"nhi nhi, that must be sarita",fear
prankonindravadhan,rosesh,i’ll get the door,neutral
prankonindravadhan,sahil,"no, just a minute",fear
prankonindravadhan,maya,kya karein,neutral
prankonindravadhan,sahil,"mom, patience, everybody be calm. jake darwana kholiye or bahar sarita aunty ko rok ke rakhiye. okay, come on. tab tak hum ye body arrange karte hai",neutral
prankonindravadhan,maya,"hi sarita, how nice to see you.",joy
prankonindravadhan,sarita,"are, lekin tumhara flat to us taraf hai.",surprise
prankonindravadhan,maya,"haan, flat to tumne kitni baar dekha hai. lekin me har baar tumhe ye corridor dikhana bhul jati hun",neutral
prankonindravadhan,sarita,corridor me kya hai esa dekhne jesa,neutral
prankonindravadhan,maya,"are bhot kuch hai. for example, ye hai na, ye mrs. desai ka flat hai. akeli rehti hai ye. esi darawni dikhti hai bilkul dayan jesi. hum log jab late night shows dekh dekh ke aate hai to jhat se apne apne gharo me ghus jate hai taki inka samna na karna pade.",disgust
prankonindravadhan,mrs. desai,hello mrs. sarabhai,neutral
prankonindravadhan,maya,hello mrs. desai,neutral
prankonindravadhan,maya,"shayad naha ke aayi hai, bhot salo baad. mene to pehle kabhi nhi dekha unhe esa.",surprise
prankonindravadhan,sahil,hi dad. kya kar rhe hai aap,neutral
prankonindravadhan,indu,kuch nhi. maya ne kaha beech beech me mat ana isliye wahan betha hun,neutral
prankonindravadhan,sahil,good boy. suna hai aap kaafi sudhar gye hai,joy
prankonindravadhan,indu,"to, subah uthne ke sath aajkal rosesh ko bhi good morning kehta hun, matlab",neutral
prankonindravadhan,sahil,to fir parso ke din aapne radha bai ke samne rosesh ka towel kyun nikal diya tha,neutral
prankonindravadhan,indu,maya ne hi kaha tha ki rosesh ka towel le ja ke drying area me sukha do. ab kab jake sukhana hai specify kiya nhi isliye mene esa kiya,neutral
prankonindravadhan,sahil,chaliye ye orange bonanza banane me meri madad kijiye.,neutral
prankonindravadhan,indu,"hmm, me mard hun",contempt
prankonindravadhan,sahil,to ye mardo wali drink hai,neutral
prankonindravadhan,indu,"acha, chal",joy
prankonindravadhan,maya,so vithal kesi rhi tumhari chutti,neutral
prankonindravadhan,vithal,"are bhot achi rhi memsahab, char sal baad gaon gya na to maa baba sab bhot khush hue. me unka ek lauta hun na",joy
prankonindravadhan,maya,really,surprise
prankonindravadhan,vithal,"haan, me ek lauta beta or meri 11 behene.",neutral
prankonindravadhan,maya,"oh. acha, mene jo mithai bheji thi wo khilayi sabko",neutral
prankonindravadhan,vithal,"haan, or mene sabse ye bhi kaha ki memsahab ne khud banai hai mithai. sabne jam ke khai. or memsahab aapko khas dhanyawad bhi kaha hai",joy
prankonindravadhan,maya,or monisha ki banai mithai kha kar...,neutral
prankonindravadhan,vithal,kuch boli nhi... bhens,neutral
prankonindravadhan,maya,bhens... vithal. bechara bezuban janwar shikayat kare bhi to kisse.,contempt
prankonindravadhan,maya,acha ye photographs jo hai na ye usme laga do.,neutral
prankonindravadhan,vithal,are memsahab is tasveer me sahab ka chehra esa kyun hai,surprise
prankonindravadhan,maya,"are haan, tum the nhi jab ye sensational kissa hua",neutral
prankonindravadhan,vithal,kya hua tha memsahab,neutral
roseshaccident,monish,nach baliye o la la la la la la nach baliye jhanjra pawa du nach baliye,joy
roseshaccident,sahil,hi monisha o,neutral
roseshaccident,monish,mister sahil main aapse nahin main aapke choreographer se disappointed hun unhen aapko itne hard steps dene hi nahin chahie the isliye main aapko sirf 6 points deti hun,neutral
roseshaccident,sahil,tabiyat theek hai na?,fear
roseshaccident,monish,"main nach baliye nach baliye khel rahi hoon. to main kya kah rahi thi ki, aapki chaal to bahut acchi hai, thodi aur graceful ho sakti hai. halaki aapki jo partner hai, monisha sarabhai vah bahut badhiya dance kar leti hai! itna achcha dance kaise kar leti hai vah?",joy
roseshaccident,sahil,kyunki vah iske alava aur kuchh karti hi nahin hai! aap ghar ki halat dekh rahi hai na judge sahiba?,contempt
roseshaccident,monish,sahil aane ke sath kurkurane ki jarurat nahin hai. main bas apna dil bhalane ki koshish kar rahi thi. pata hai aaj main bahut upset hun!,sadness
roseshaccident,sahil,kyon aaj kya hua?,surprise
roseshaccident,monish,jivan general store band ho gaya,sadness
roseshaccident,sahil,to?,neutral
roseshaccident,monish,to kya? vahan per sari chijen itni sasti milati thi pata hai baniyan ke sirf 600 rupaye,sadness
roseshaccident,sahil,baniyan ke 600 rupaye tumhen saste lagte hain?,neutral
roseshaccident,monish,600 rupaye kilo sahil! usmein 30-35 baniyan to aa hi jaati thi.,neutral
roseshaccident,sahil,matlab vah actually baniyan kilo ke bhav bechta tha?,surprise
roseshaccident,monish,person hi to layi thi pav kilo baniyan bhul gaye?,neutral
roseshaccident,sahil,"han wonderful. vah bechta kaise hai? ""lelo lelo lelo garma garam tazein underwear baniyan moze rumal sirf 600 rupaye kilo!""",contempt
roseshaccident,monish,sahil suno na ruko,neutral
roseshaccident,rosesh,sahil bhai sahil bhai trouble,fear
roseshaccident,monish,yes hua to dikhai de raha hai k u r in trouble. vaise aapke donon pairon ki jo chemistry hai na vah match nahin kar rahi hai,neutral
roseshaccident,rosesh,chemistry kahan se milegi bhabhi? sahil bhai mujhse ek accident ho gaya. maine ek aadami ko apni car se uda diya!,sadness
roseshaccident,sahil,what?!,surprise
roseshaccident,maya,yah main nahin hone dungi. rosesh ko agar jail le gaye to me to...,fear
roseshaccident,dushyant,sadma jhail nahin payenge write? are wow jail jhail,joy
roseshaccident,maya,how wonderful,neutral
roseshaccident,dushyant,"thanks rosesh tum samjhe ki nahin? jail jana aur jhelna. jail jhail. they are called homosonic words. i'll give you one more example, safar suffer. right? one more...",neutral
roseshaccident,maya,dushyant will you please keep quiet? no! will you please get out?,anger
roseshaccident,dushyant,ok i'll keep quiet,neutral
roseshaccident,maya,rosesh maine soch liya hai. ham log unhen compensation offer karke unhen samjhe ayenge ki tumhen arrest na karen lekin agar na mane to tum heart attack le aana.,neutral
roseshaccident,rosesh,yes,joy
roseshaccident,maya,ok to practice now. aise chhati pakad ke aaa dard se karahao,neutral
roseshaccident,rosesh,right now?,neutral
roseshaccident,maya,tum dekhna ha,neutral
roseshaccident,rosesh,"see, aaa, aaa",neutral
roseshaccident,dushyant,yah to aise lag raha hai jaise a use heart attack hone ka maja a raha hai,joy
roseshaccident,maya,"right pain pain, rosesh, come on! aahhh. ese pain",neutral
roseshaccident,rosesh,nahin yah overacting ho jayegi momma.,neutral
roseshaccident,maya,"rosesh wo log sab middle class honge bichare hindi filmon ke shaukeen, unhe over acting acchi lagegi tum karo na.",contempt
roseshaccident,rosesh,"ok. aa, aa, aa.",neutral
roseshaccident,dushyant,yah to aisa lag raha hai jaise kanta laga ho. i thought you were an actor.,contempt
roseshaccident,maya,ok just try na pain. imagine ki tum monisha ki ragada pattice mein yahan tak fanse hue ho,neutral
roseshaccident,rosesh,oh my god momma!,fear
roseshaccident,maya,"right that's a good heart attack. so, compensation, nahin mane to heart attack.",joy
roseshaccident,dushyant,ya idli italy. see homosonic words,neutral
roseshaccident,maya,dushyant please go,sadness
roseshaccident,sahil,monisha telephone ki diary kahan hai?,anger
roseshaccident,monish,jiska jkl wale alphabet page fate hue hain? ya fir jiske pqrs wale alphabet page fate hue hain?,neutral
roseshaccident,sahil,pqrs wale alphabet pages jo fate hue hain na wo wali diary mujhe nahin chahie kyunki mein rajnikant talati ka number dhundh raha hun.,neutral
roseshaccident,monish,huh! rajnikanth talati! vah mashhur vakil!,joy
roseshaccident,sahil,rajnikant bhai ka naam sunkar tum itna kyon khush ho rahi ho? vah to sirf ek bade vakil hai.,neutral
roseshaccident,monish,"unki beti hai na trishna vah tv serial actress hai! kabhi saas kabhi nagin serial, usme sarla nagin ki sauteli behen ka role, trishna kar rhi hai.",joy
roseshaccident,sahil,to trishna bhi nagin bani hai?,neutral
roseshaccident,monish,nahin nahin vah to ladki bani hai,neutral
roseshaccident,sahil,lekin tum hi ne to kaha ki vah sarla nagin ki sauteli,neutral
roseshaccident,monish,"are baba sarla nagin ki jo maa hai na vah nagin hai, lekin trishna ki jo man hai vah chudail hai. aur unka jo baap hai na, wo...",neutral
roseshaccident,sahil,vo mendhak hai!,contempt
roseshaccident,monish,tch tch tch.,neutral
roseshaccident,sahil,whatever lekin kabhi saas kabhi nagin ki story ham kisi aur din sunenge filhal chala rosesh kaidi banne ki story ka kuchh karen? diary do mujhe.,anger
roseshaccident,monish,han 1 minute han.,neutral
roseshaccident,monish,balcony mein sukhane ke bad shayad vahan rakhi thi,neutral
roseshaccident,sahil,sukhane ke bad matlab tumne diary dhoi thi?,surprise
roseshaccident,monish,hat! vah to pani ke matke mein rakhi thi,neutral
roseshaccident,sahil,lekin tumne pani ke matke mein diary kyon rakhi?,neutral
roseshaccident,monish,usmein pani nahin tha kya,neutral
roseshaccident,sahil,monisha fir bhi e,anger
roseshaccident,monish,diary idhar udhar na ho jaaye isliye main pani ke matke mein rakhi thi sambhal ke. lekin vah jo nai bai thi na subhadra?,neutral
roseshaccident,sahil,jo aadha din kam kar ke bhag gai?,contempt
roseshaccident,monish,han vahi kamini usne matke mein pani dal diya bolo,anger
roseshaccident,sahil,pani ke matke mein usne pani dal diya? kitni bevkuf hogi wo. chai banane ke liye chai ki patti dal degi patile mein haina?,contempt
roseshaccident,monish,tum mujhe tana maar rahe ho sahil?,sadness
roseshaccident,sahil,to aur kya kya marun me tumhen?,anger
roseshaccident,monish,aaaa sahil!,fear
roseshaccident,madhusudhan,hi sahil hi monisha,neutral
roseshaccident,monish,namaste madhu fufa,joy
roseshaccident,sahil,hain hain festival shuru...,sadness
roseshaccident,madhusudhan,hain?,neutral
roseshaccident,sahil,aap is waqt yahan?,neutral
roseshaccident,madhusudhan,9:50,neutral
roseshaccident,monish,nahin nahin aap yahan kya kar rahe hain?,neutral
roseshaccident,madhusudhan,main yahan?,neutral
roseshaccident,monish,han! dekha,joy
roseshaccident,madhusudhan,samaj kalyan centre jana hai blood donet karne,neutral
roseshaccident,monish,achha?,joy
roseshaccident,madhusudhan,han main har mahine blood ki ek bottle donate karta hun. lekin kya hai aaj taxi ki strike hai to mujhe jara drop kar doge?,neutral
roseshaccident,sahil,dekhiae kya hai rosesh jo hai na...,neutral
roseshaccident,madhusudhan,hain?,neutral
roseshaccident,sahil,ab rosesh ka chapter ine ko kaise samjhaenge? tumhare ishare hua samajhte hain handle him.,anger
roseshaccident,maya,i will handle everything rosesh...,neutral
roseshaccident,rosesh,"momma police ka phone bhi a gaya hai aur social activist chilla chilla ke kah rahi thi ki ""tumhen jail bhijwa ke rahungi rosesh sarabhai!""",sadness
roseshaccident,maya,well vah to unchi awaaz mein bolegi hi na. uska naam kya hai?,neutral
roseshaccident,rosesh,monisha seth.,sadness
roseshaccident,maya,to!?,neutral
roseshaccident,rosesh,mujhe jail ho jayegi momma!,sadness
roseshaccident,maya,offo rosesh! tumne use aadami ko jaan se to nahin mara na? han to tumhen jail nahin hogi. jyada se jyada tumhara licence japt kar lenge.,neutral
roseshaccident,rosesh,licence to hai hi nahin mere pass pahle se. aur maine thodi si whiskey pii hui thi gadi chalane ke pahle se. aur gadi thodi si tej chala raha tha. aur gadi ke brakes aur horn kharab the.,neutral
roseshaccident,maya,aur? to tumhen jail ho sakti hai shayad,fear
roseshaccident,rosesh,lekin momma mein jail mein kaise rahunga? you to know me. vah istemal kiya hua uniform denge pahnane ke liye aur main...,sadness
roseshaccident,maya,to main unhen request karungi personally ke tumhen naya uniform den,anger
roseshaccident,rosesh,matlab aapko bhi yakin ho gaya ki main jail jaunga?,sadness
roseshaccident,maya,naturally rosesh. licence nahi...,neutral
roseshaccident,dushyant,mom rosesh yahan hai aap log? do you know something? fluorescent hoarding dekhne se aankhen damage ho sakti hai?,neutral
roseshaccident,maya,oh really? kaise?,neutral
roseshaccident,dushyant,"i'll explain. please. man lijiye ki rosesh aankhen hai aur aap fluorescent hoarding, right saree. to aap chamakiye aur rosesh, mom ko dekho aur band ho jao.",neutral
roseshaccident,rosesh,main band hi hone wala hun dushyant jail mein,sadness
roseshaccident,maya,rosesh se ek accident ho gaya hai dushyant. usne kisi ek aadami ko apni gadi se uda diya.,sadness
roseshaccident,dushyant,oh my god! kaisi halat hai gadi ki? i mean sirf paint nikala hua hai yah gadi ki body bhi damage hui hai?,sadness
roseshaccident,maya,use aadami ki tang fracture ho gai hai dushyant!,anger
roseshaccident,dushyant,main poochh kya raha hun aur mom jawab kya de rahi hain.,neutral
roseshaccident,rosesh,momma police aur social activist pahunchne hi wale honge. kuchh kijiye please!,sadness
roseshaccident,maya,"rosesh please, aisi baten karke mujhe darao mat! oh god! agar un logon ne kuch zyatti ki to?",fear
roseshaccident,rosesh,mommma mommma!,sadness
roseshaccident,inspector,chalo! bade baap ki bigadi hui aulad!,anger
roseshaccident,indu,"inspector sahab, bade baap ki nahin badi maa ki. yah maya ke laad pyar ne hi ise bigada hai",anger
roseshaccident,maya,"inspector sahab, mera baccha nadan hai, masoom hai.",sadness
roseshaccident,indu,nahin! yah bore hai irritating hai!,disgust
roseshaccident,maya,indravadan tum baap ho iske ya dushman? dekha inspector sahab is mein bhi sochana pad raha hai,anger
roseshaccident,inspector,"dekhiae madam, yah baap hai ya dushman, yah ham nahin jante. ham to sirf itna jante hain ki rosesh mujrim hai! chalo",anger
roseshaccident,rosesh,main jaan mujra kar use aadami ko nahin mara hai inspector sahab,sadness
roseshaccident,maya,han vah aadami jaan mujh kar a gaya raste mein uski gadi ke samne,neutral
roseshaccident,inspector,madam vah aadami footpath per chal raha tha!,anger
roseshaccident,maya,tum footpath per gadi chala rahe the?,surprise
roseshaccident,rosesh,"momma sadak per barat ja rahi, thi log nach rahe the, to main...",neutral
roseshaccident,maya,raat ko barat jarur monisha ke kisi punjabi rishtedar ki barat hogi vah,contempt
roseshaccident,rosesh,vah to gana bhi baja rahe the aaj mere yaar ki shaadi hai aaj mere yaar ki shaadi hai,neutral
roseshaccident,maya,oh god how mediocre. chakmak sadiyan aur safari suit pahan ke bhangra kar rahe the?,contempt
roseshaccident,rosesh,han momma,neutral
roseshaccident,maya,how middle class can you get?,disgust
roseshaccident,indu,maya ab tum is waqt kahan middle class ki maravat karne baith gai?,neutral
roseshaccident,maya,nahin nahin main sabit karne ki koshish kar rahi hun ki kyon rosesh footpath per gadi chala raha tha use downmarket barat se bachne ki koshish kar raha tha you know. you understand sir,neutral
roseshaccident,inspector,yahi yahi argument aap court mein karna chalo,anger
roseshaccident,maya,high court ya local magistrates court ?,contempt
roseshaccident,inspector,yah case ham supreme court mein chalayen?,contempt
roseshaccident,maya,that would be much better. kyunki local magistrates court me argue karna is very downmarket,disgust
roseshaccident,indu,inspector sahab lijiye aur daal dijiye is kaal kothri mein,anger
roseshaccident,maya,mera baccha...,sadness
roseshaccident,rosesh,momma,sadness
african,dushyant,sahil,neutral
african,sahil,you spoke too soon,sadness
african,dushyant,main tum donon ko ek bahut hi important baat batana chahta hun,neutral
african,sahi,kya,neutral
african,dushyant,main tum donon ko ek bahut hi important baat batana chahta hun,neutral
african,sahil,voh pata chala baat kya hai,neutral
african,dushyant,oh i thought you said kya tu mujhe hehe,joy
african,sahil,hehe,neutral
african,sahil,kya baat kya hai vah batao na,anger
african,dushyant,pahle promise me ki tum yah baat kisi ko nahin bataaoge,neutral
african,rosesh,okay promise... lekin batao to sahi ki kya hai,neutral
african,dushyant,nahi rosesh yaha nahi,fear
african,dushyant,"sahil, tumhare bedroom main chalte hai",neutral
african,sahil,yaha kya problem hai?,surprise
african,dushyant,suna hai deewaron ke bhi kaan hote hain,neutral
african,sahil,to bedroom main deeware nahi hoti?,neutral
african,dushyant,han lekin vahan ki deeware comparatively chhoti hai,neutral
african,dushyant,use your head sahil,contempt
african,dushyant,yeah come come.,neutral
african,dushyant,hi there.,neutral
african,monisha,dushyant jija ji namaskar..ye lijiye prasad...thappad baba ka prasad hai kya,neutral
african,sahil,thappad baba ka... hehehe,joy
african,monisha,"sahil, tum thappad baba ke bareme aisa vaisa kuchh nahi kehna...pata hai vah bahut bade baba hai... amavas ki raat ko vo jor jor se apna sar patakte hai...amavas ki raat ko unki biwi ki atma unke andar ghus haati hai",neutral
african,rosesh,to usme vo sar kyu patakte hai?,neutral
african,sahil,aray come on rosesh...mari hui biwi ki aatma wapas aaegi rosesh... vo bhi apne sharir mein...to koi bhi sar patkega na,joy
african,dushyant,"sahil, rosesh... kya ho raha hai ye... main yahan itni important baat batane aaya hun aur tum logonki.. monisha",sadness
african,monisha,haa good idea,neutral
african,dushyant,will you get out?,neutral
african,monisha,kya?,surprise
african,indravardhan,madhubhai aap ki ghadi ki battery weak ho gai hai,neutral
african,madhusudan,hai?,neutral
african,indravardhan, ghadi ki battery weak ho gai hai,sadness
african,madhusudan,achcha to dawai kyon nahin leta...kahi bukhaar to nahin hai?,fear
african,indravardhan,madhubhai mein apne tabiyat ki baat nahin kar raha hun..aap ki ghadi ki baat kar rahi raha hun...uski battery weak ho gai hai,anger
african,madhusudan,hai?,neutral
african,dushyant,ha baitho... ha so sahil...dhyan se suno..ross.. rosesh!... kya likh rahe ho tum.,anger
african,rosesh,notes! shayad ismeise mujhe loi kahani mil jaaye... you carry on dushyant!,neutral
african,dushyant,blue pen se?,neutral
african,dushyant,dekho fir xerox nikaalne hogi to mujhe mat kehana... dushyant do do something.. ok!,fear
african,dushyant,and because you know...,neutral
african,sahil,mechanic... baat kya hai.,neutral
african,dushyant,ha ha... sahil... tum ye mantra padho... african chant... just read it out,neutral
african,sahil,kobara... tadimba... halumulu.. diya... shejaro... natikitika,joy
african,dushyant,ab ek chetavni,neutral
african,sahil,ab ek chetavni!,surprise
african,dushyant,haa... tum jo bologe vo hoga,neutral
african,sahil,kya!?,surprise
african,dushyant,iska ekdam midas touch...to jo bhi bolna soch samajh ke bolna,fear
african,dushyant,you know for example... agar tum ne kaha ki rosesh chup maro.. to rosesh chup bhi rahega aur mar bhi jayega,neutral
african,dushyant,its like midas tongue actually!,neutral
african,rosesh,really! what are you saying!,joy
african,dushyant,yahi ki... its like the midas touch... tum jo bhi bologe soch samajh kar bolna.. tumne agar kaha...,neutral
african,rosesh,dushyant please!,anger
african,sahil,he got it dushyant... now let me confirm... mai jo bhi bolunga vah hoga,neutral
african,dushyant,correct,neutral
african,sahil,khade raho dushyant,neutral
african,dushyant,okay,neutral
african,sahil,dushyant tum gadhe ho,neutral
african,dushyant,hehe.. mar gaye tum log... ab main gadha ban jaunga to fir mujhe mat kehana.. ok!?,joy
african,sahil,(donkey noise).. chalo chalo gadhe bano!,contempt
african,sahil,hehe... dushyant... ye raha tumhara african chant and give me a break,joy
african,rosesh,he's mad... hehe,joy
african,dushyant,kamal hai ye... something is... hmmm... no wonder.... rosesh... heh... ye padho,joy
african,rosesh,conditions apply... mantra 8 ghantoke baad activate hoga... aur fir mantra bolane wale ki ichcha turant asar dikhegi... you mean.. sahil bhai.. oh god.. sahil bhai,fear
african,madhusudan,are bata kyu nahi hai meri ghadi ko kya hua hai,neutral
african,indravardhan,"are batata hun beharelal, batata hun...pen de na",anger
african,madhusudan,hai?,neutral
african,indravardhan,main aapko nahi sambhal sakta,sadness
african,madhusudan,achcha...kitne pound ka hai?,joy
