episode,speakers,utterances,emotions
introductiontothesarabhaifamily.avi,monisha,hain! kab?,neutral
introductiontothesarabhaifamily.avi,indravardhan,arey tum bhul gayi! wo tribhubandas ki bete ki shaadi mein tum kaha itne logon ke saamne ki agar janwaron ka naagron mein fancy dress competetition hoota to naagin maya ban ke aati. aur prize bhi leeti.,joy
introductiontothesarabhaifamily.avi,maya,arey arey! tum aisa joke mara!,surprise
introductiontothesarabhaifamily.avi,indravardhan,wo bhi hazar log ke saamne!,neutral
introductiontothesarabhaifamily.avi,sahil,narad muni!,sadness
introductiontothesarabhaifamily.avi,indravardhan,arey tum aye bhi nahi na isse tumhe paata nahi.,joy
introductiontothesarabhaifamily.avi,maya,ayi bhi hoote to mujhe pata kaise chaalta ki usne aisa joke maara?,neutral
introductiontothesarabhaifamily.avi,indravardhan,pata chalta kyuki usne mike pe ye joke mara tha.,neutral
introductiontothesarabhaifamily.avi,maya,mike!,surprise
introductiontothesarabhaifamily.avi,roshesh,bhaabi!,surprise
introductiontothesarabhaifamily.avi,monisha,mummyji bhi ne aise joke mara na. hian na?,fear
introductiontothesarabhaifamily.avi,maya,mike pe nahi mara beta. aue apne ki family ki chaar logon ki saamne hi maara. do hazar loogon ke samne indravardhan!,sadness
introductiontothesarabhaifamily.avi,indravardhan,aur logon ne once more bhi kaha!,neutral
introductiontothesarabhaifamily.avi,monisha,lekin mein dobaara wo joke nahi sunaya! i promise!,fear
introductiontothesarabhaifamily.avi,indravardhan,haan. mike kharaab ho gaya tha na.,joy
introductiontothesarabhaifamily.avi,monisha,mein ghar chod kar ja rahi hoon. ab please ye mat puchna ki mein kaha ja raho hoon.,sadness
introductiontothesarabhaifamily.avi,indravardhan,"arey arey arey sahil bete ye kya kar rahe ho? usse rokne ke wajay, manane ki wajay tum uske bag thik se pack kar rahe ho?",neutral
introductiontothesarabhaifamily.avi,monisha,"haan haan karo karo, thik se pack karo tum to cahate hi ho na ki mein ghar chood ke chaali jayu? tum bhi to sarabhai family ki ho na. rayis khoon aur middle class monisha singh. singh aluwaliya nahi, singh bedi nahi, singh bhatti bhi nahi sirf singh. phir to surname mein bhi bachat. to bachat karne mein kuch goonah hain kya? mein saabjiwale se kaha ki ek kilo fhulkopi ki tis rupaya nahi dungi to ho gayi shuru. "" beta bargain karna humain sobha nahi dete, its so middle class!"" wo bhi saabziwaale ki saamne! uske baad wo kya khaas bhao khaata. pucho daddy se.",sadness
introductiontothesarabhaifamily.avi,indravardhan,haan haan ek ghaante se ye behes kaarti rahi to phir wo jaake cauliflower ki tis rupaya se untis rupaya ki.,neutral
introductiontothesarabhaifamily.avi,sahil,"ha ha haan accha baby, ye saab ek rupaya bachane ke liye?",neutral
introductiontothesarabhaifamily.avi,monisha,das kilo khareedke das rupaya baacha to leti! magar mujhe to srif pao kilo cahiye tha na to srif chawan hi baacha payi.,sadness
introductiontothesarabhaifamily.avi,indravardhan,haan to cawan hi to bachayi na/,neutral
introductiontothesarabhaifamily.avi,monisha,"miss high society! saabziwaale se bhi english mein baat karti hain! bhaiya ji okra hain, okra?",contempt
introductiontothesarabhaifamily.avi,indravardhan,haan haan kya kya cahiye aapko?,neutral
introductiontothesarabhaifamily.avi,monisha,ladies finger,contempt
introductiontothesarabhaifamily.avi,indravardhan,"ladies finger haamre paas kaha se hoogi, hum to gents hain!",joy
introductiontothesarabhaifamily.avi,monisha,dekha! seedhi seedhi bhindi nahi maang saakti?,anger
introductiontothesarabhaifamily.avi,indravardhan,"arey monisha to kaaha bhi maya se. mummy bhindi bhindi. mummy ne kya kiya, monisha bete aise gaali nahi dete.",contempt
introductiontothesarabhaifamily.avi,monisha,bhindi ko koi gaali keheta hain?,anger
introductiontothesarabhaifamily.avi,sahil,nahi mein mom ko samjhaunga ki ainda wo bhindi ko okra ya ladies finger na kahe. lekin sweetheart tum please ghar choorke mat jao. mom ko pata chalega to wo naraj ho jayenge.,neutral
introductiontothesarabhaifamily.avi,monisha,wo naraj nahi hoonge. ulte mithaiya baantenge sahil.,anger
introductiontothesarabhaifamily.avi,sahil,arey tum aisa kyu sochti ho? mom aisa nahi hai!,neutral
introductiontothesarabhaifamily.avi,radha bai,"chotti memsaab, baade memsaab ne aapke liye anjir ki barfi bheeji hain.",joy
introductiontothesarabhaifamily.avi,sahil,mom ko kisne bheeji ye baarfi?,neutral
introductiontothesarabhaifamily.avi,indravardhan,"ye to maya ne aapne haato se khud banayi hain, pata nahi kis khussi mein hain na?",neutral
introductiontothesarabhaifamily.avi,radha bai,"haan, aur saat mein gaana bhi ga rahi thi - paanchi banu udti firu maast gagan mein",joy
introductiontothesarabhaifamily.avi,sahil,tumhe ye pata tha manthra bai,anger
introductiontothesarabhaifamily.avi,radha bai,"sahil baba, aapne mujhe manthara kaha?",sadness
jugalkishore.wmv,maya,"bas bas naisha, bas abhi. ab chod diya na tumhne uss fernando ko!",neutral
jugalkishore.wmv,naisha,but abhi bhi usse bhool nahi,sadness
jugalkishore.wmv,rosesh,"naisha massi, humne suna hain ki aapne ex-husband bohot acche the!",neutral
jugalkishore.wmv,naisha,he was a darling,sadness
jugalkishore.wmv,rosesh,problem kya thi?,neutral
jugalkishore.wmv,naisha,"uski ma. ek number ki irritating, dominating, interfearing witch thi wo. you know kissi opera singer ke tarah aati thi subaah hummne uthane - wake up, fernando wake up naisha we used to get up and say, please mumma please stop singing! so wo gaana bandh kar ke rone lagti thi.",neutral
jugalkishore.wmv,maya,gana to bandh karti thi na thankfully!,joy
jugalkishore.wmv,naisha,haan lekin usske baad wo jo har octave mein rroti thi uska kya? it used to be unbearable and finally we used to say please mumma please sing! that sounds better!,neutral
jugalkishore.wmv,indravardhan,lekin wo to bata rahin thi ki divorce ke wajah kuuch aur hi thi. uska kissi drug addict ke saath affair ho gaya tha,neutral
jugalkishore.wmv,naisha,arey nahi….fernando ka nahi. drug addict ke saath to affair mera huya tha,joy
jugalkishore.wmv,rosesh,aur beach pe bina kapdo ke baaghna?,neutral
jugalkishore.wmv,naisha,"that one was me. he he he aur mera fernando mera kaapde leke daurta tha. sweety, you'll catch a cold t-shirt pehen lo at least! silly adorable darling! lekin uska ma wo kaan bhaarti thi apna fernando ke. i'll never forget….itna gussa aa raha hain na mujhe uspe...",anger
jugalkishore.wmv,indravardhan,"rosesh, crockery crockery samhaal.",fear
jugalkishore.wmv,maya,"calm down naisha, just calm down.",fear
jugalkishore.wmv,sahil,calm down and give all your woes to me my darling massi!,joy
jugalkishore.wmv,naisha,oh! isn't that sahil?,joy
jugalkishore.wmv,maya,yes it is,joy
jugalkishore.wmv,naisha,"ohhhh sahil, oh my goodness! my pumpkin! my poodle, my pretty porcupine without quills. ab to bilkul mere jaise dikhne lag gaya mere baby!",joy
jugalkishore.wmv,maya,"yes, resemblance hain na? aur thank god tum a gayi hain sahil, jab se aayi hain ye peheli baar smile aya iske cehere pe",joy
jugalkishore.wmv,naisha,"so true by the way sahil, apne biwi monisha se to milwao!",joy
jugalkishore.wmv,maya,"wonderful, smile gayab!",neutral
jugalkishore.wmv,maya,"naisha ka beechari ka divorce ho gaya…indi, divorce!",sadness
jugalkishore.wmv,indravardhan,wo to hoona hi tha. waise bhi wo saal do saal mein divorce lete hi reheti hain. uska chaowtha divorce hain na?,neutral
jugalkishore.wmv,maya,paanch. lekin uska ye waala husband bohot accha tha indu. uski crystal aur bone china ki crockery ki factory hain spain mein.,neutral
jugalkishore.wmv,indravardhan,accha accha crockery ki factory hain to accha ho gaya?,neutral
jugalkishore.wmv,maya,nahi nahi agar gusse mein aake ek do crockery todti hain na…isliye. fernando to apne se la kar deta tha ek do crockery…mikha you can break this if you're angry.,contempt
jugalkishore.wmv,indravardhan,wo saab to theek hain lekin divorce huya kyu?,neutral
jugalkishore.wmv,maya,humme samajti nahin hain…..woi saare chotti chotti baatein,neutral
jugalkishore.wmv,jugalkishore,jugalkishore ji punjab se aa gaye hain!,joy
jugalkishore.wmv,monisha,jugaal chalte firte….kaisa hai tu?,joy
jugalkishore.wmv,jugalkishore,arey kinni soni lag rahein hain meri chudail,joy
jugalkishore.wmv,together,dancing in punjabi,joy
jugalkishore.wmv,monisha,kaisa raha tu?,joy
jugalkishore.wmv,jugalkishore,"oye bohot changa. ac chair car mein aya hoon par unhone ne bas teen time rooti khilayi. arey haan…tere liye mein biscuit, juice aur gala thande karne waali goli laye hoon aur ye blanket bhi laya hoon",joy
jugalkishore.wmv,monisha,hayo rabba! eki hain! ye to train diya imanat hain to ye kyu le aya?,anger
jugalkishore.wmv,,"wahi to puuch ke laya hoon. aur me tt se saaf saabdo mein collar pakadke poocha - tt ke bacche, mein ye blanket le jayoonga to wo bola bhaisaab le jao. aise koi khasiyat nahi hain. problem kya hain/",neutral
jugalkishore.wmv,sahil,"monisha, guest room ready and welcome jugalkishore ji",joy
jugalkishore.wmv,jugalkishore,oyee meri jaan! meri chanda rani. muuah muuah muuah…,joy
jugalkishore.wmv,sahil,"ek minute….haan mein sahil hoon, sahil raja….chanda rani nahi",anger
jugalkishore.wmv,jugalkishore,"wo shakal! sahil teri shakal bilkul chandarani se milti hain! arey wo monisha, apne ko yaad hain wo aapna sujit singh? wo ludhiana wala! wo jo chowk pe jalebi talta tha!",neutral
jugalkishore.wmv,monisha,arey wo halwai jiska ek haat jalebi taale aur dusra haath naak mein hota tha?,joy
jugalkishore.wmv,jugalkishore,"arey wo uski biwi chandarani, uski shakal aur sahil ke sakal mila. lagti hain na ek jaisi? ek minute, tu na apna akkha bandh kar. bandh kar ab uska war dekh. soch. ek, do, tre, chaar, chatt…ab kholke dekh",joy
jugalkishore.wmv,monisha,hai na….chandarani?,surprise
jugalkishore.wmv,jugalkishore,chandarani?,neutral
jugalkishore.wmv,sahil,pagal ho gaya tu?,anger
jugalkishore.wmv,monisha,bilkul chandarani! same to same! chandarani.,joy
jugalkishore.wmv,sahil,"calm down…calm down. dekho jugalkishore, mere shakal bhalehi tumhaare wo chandarani se milti ho lekin baaki kucch nahi milti.",neutral
jugalkishore.wmv,monisha,haan baki to ye bilkul sahil jaisa hi hain,sadness
jugalkishore.wmv,sahil,sahill haisa hi hain ka kya matlab hain? sahil hi to hain!,neutral
jugalkishore.wmv,jugalkishore,"ahh kaash, agar tu pura ka pura chnadarani jaisa hi hota! to na main tujhe uthake le jata!",joy
jugalkishore.wmv,sahil,ye to jaake tumhaari chandarani ko uthana brother!,contempt
jugalkishore.wmv,jugalkishore,oh ho….ye to main roz keheta hoon chandarani ko! lekin wo humhein husband maane to na!,neutral
jugalkishore.wmv,sahil,wo shadishuda hain?,surprise
jugalkishore.wmv,jugalkishore,"wo chandarani jo hain. wo shaadisuuda hain. aur uska humshakal jo hain, wo ladka hain. meri to kismat hi footi hui hain monisha!",sadness
jugalkishore.wmv,monisha,"arey to chinta na kare tu jugal, hum tere waaste chnadarani se bhi acchi sakal acchi kudi dhoond ke laayenge",joy
jugalkishore.wmv,jugalkishore,"mujhe to chandarani ki hi sakal pasand hain! aur jaanti hain na monisha, duniya mein ek sakal ka 7 loog hootein hain. ek ho gayi hamara chandarani, dujja ho gayi humara jugal, baki baancha huya paanch, usme se kissi ek cehera to mere kissam mein zaroor likkha hoga monisha! zaroor likha hoga!",neutral
jugalkishore.wmv,monisha,oye jugal tera jaldi jaldi pooncha laga. nayesha maussi jab ye ghar mein aaye tab unhe bhi lage ki ye ghar bhi ghar hain.,joy
jugalkishore.wmv,jugalkishore,monisha? tu kya kabhi kabhi ghar ki safai karti hain? sahil jaisa pati hain fir bhi? meri biwi agar sahil jaisa hoti to main mahalle ki har kome chamka ke rakhta!,neutral
jugalkishore.wmv,monisha,milegi milegi baba zaroor milegi. agar teri kismat acchi raha na to tenu ko sahil aur chandarani ki duplicate zaroor milegi.,joy
jugalkishore.wmv,naisha,excuse me! memsaab hain ghar mein?,neutral
jugalkishore.wmv,monisha,ap kaun?,neutral
jugalkishore.wmv,naisha,monisha?,joy
jugalkishore.wmv,monisha,naisha massi!,joy
jugalkishore.wmv,jugalkishore,chandarani!,joy
jugalkishore.wmv,naisha,monisha!,joy
jugalkishore.wmv,jugalkishore,ha ha ab meri baari chandarani. aja ja jhappi dal de.,joy
jugalkishore.wmv,naisha,excuse me! i beg your pardon!,neutral
jugalkishore.wmv,jugalkishore,oye pardon nahi…jhappi! monisha ye mil gayi mujhe! i will love you! you will love me?,joy
jugalkishore.wmv,naisha,what?,anger
jugalkishore.wmv,sahil,oh wow,joy
jugalkishore.wmv,maya,kaisa hain?,joy
jugalkishore.wmv,sahil,extremely good! kya baat hain mom ? aap istarah kyu dekh rahi ho?,joy
jugalkishore.wmv,maya,"tumhe dekh rahi hoon. kitna handsome sophisticated, cultured hain mera beta",joy
jugalkishore.wmv,sahil,thank you,joy
jugalkishore.wmv,maya,tumhe dekhke kaun manega ki tum monisha ke husband ho.,contempt
jugalkishore.wmv,sahil,mom,neutral
jugalkishore.wmv,maya,"nahi nahi main monisha ki burayi nahi kar rahi hoon. monisha is a perfectly nice avarage girl. in fact chappal gisaat bina kissi ghar mein aati hain to mein haskar ye bhi keheti hoon ki hello beta, kaise ho but othewise you know i'm…",contempt
jugalkishore.wmv,sahil,mom,neutral
jugalkishore.wmv,maya,accha accha okay okay i'm sorry. let me get you some juice,neutral
jugalkishore.wmv,sahil,mom ek baat bataiyein. agar chiraag se nikla huya genie aapko kahi mil jaaye aur wo aapko teen wish deti hain to aap konsi wish mangoge?,neutral
jugalkishore.wmv,maya,saabke pehele wish to ye hoogi to please duniya ki saare gareebi gayab ho jaye mr genie,neutral
jugalkishore.wmv,sahil,mr genie kahe ki aap saach saach khye to?,joy
jugalkishore.wmv,maya,to main kahungi ki monisha ko gayab kar dijiye gareebi ko main dekh lungi,neutral
jugalkishore.wmv,sahil,mom acche dusri aur teesri wish?,neutral
jugalkishore.wmv,maya,"one second,",neutral
jugalkishore.wmv,rosesh,"momma,",neutral
jugalkishore.wmv,maya,kya hua beta,neutral
jugalkishore.wmv,rosesh,accha bathroom ke saath koi word ryme nahi kar raha hain koi word bataiyein na,neutral
jugalkishore.wmv,maya,bathroom?,surprise
jugalkishore.wmv,sahil,mom aap genie ki dusri aur teesri wish mujhe de dijiye ta ki main kahoon ki genie aap please iski kavita likhna bandh kar dijiye,neutral
jugalkishore.wmv,rosesh,"momma, aap batiyein na bathroom ke saath koi word ryme kar rahein hain kya?",neutral
jugalkishore.wmv,maya,"bathroom, room, boom, zoom, masoom",neutral
jugalkishore.wmv,rosesh,"ho gaya masoom….suniye….uff ye karz, uff acidity, uff ye jana roj bathroom, blue tiles ke beech white white toilet, asmaan ke beech jaise badal masoom.",joy
jugalkishore.wmv,sahil,"mr genie mr genie, aap iska gala dabaiye gala dabaiye",anger
jugalkishore.wmv,maya,"stop it you boys…oh god mujhe bilkul déjà vu ka experience ho raha hain jaise ki ye scene aise pehele hi hua. you know hum teeno tum, main aur rosesh in a sophisticated breakfast, brotherhood, pure happiness….aur achanak mera sapna choor choor ho jata hain",joy
jugalkishore.wmv,monisha,mummyji,joy
jugalkishore.wmv,maya,ho gaya na churchur,neutral
jugalkishore.wmv,rosesh,he he he so funny!,joy
jugalkishore.wmv,sahil,"monisha kya baat hain, tum itna excited kyu ho?",neutral
jugalkishore.wmv,maya,sabziwaale ne tumko mirchi aur dhaniya free mein de diye kya?,contempt
jugalkishore.wmv,monisha,"nahi nahi mummyji, isse bhi acchi khabar hain! jugalkishore hain na mera cousin brother",joy
jugalkishore.wmv,maya,"cousin monisha, cousin brother is so middle class",disgust
jugalkishore.wmv,sahil,lekin wo jugalkishore ka kya?,neutral
jugalkishore.wmv,monisha,"haan, wo haamare saath rehene aa raha hain sahil.",joy
jugalkishore.wmv,maya,phone kahan hain?,neutral
jugalkishore.wmv,rosesh,momma international call,neutral
jugalkishore.wmv,maya,hello…aah naisha….tumaha naisha massi spain se bol rahi. haan haan bolo naisha. haan. what?,surprise
jugalkishore.wmv,maya,but this is the limit! usne saach me tumhe propose kiya?,anger
jugalkishore.wmv,naisha,usne mujhse kaha ki (inaudible in punjabi),sadness
jugalkishore.wmv,indravardhan,tumhe punjabi aati hain?,neutral
jugalkishore.wmv,naisha,"no, wo aisa mere haath pakad ke gas stove ke aas paas phere lete huye kaha jiju. so i figured ki…",sadness
jugalkishore.wmv,maya,aur wo monisha? wo kya kar rahi thi? khade khade tamasha dekh rahi thi wo?,anger
jugalkishore.wmv,naisha,nahi jab humaare ye moch marriage chal rahi thi tab wo niche gayi thi kachda dispose off karne ke liye.,neutral
jugalkishore.wmv,rosesh,monisha bhabi kachda fekne gayi thi? unke ghar mein kachda nahi tha?,surprise
jugalkishore.wmv,naisha,no ghar to spotlessly clean tha,sadness
jugalkishore.wmv,maya,"to tum shayad galat ghar mein chali gayi hogi, monisha ka ghar humaare saamne wala. accha batao, wahan jaali huyi khisdi ki badboo aa rahii thi?",neutral
jugalkishore.wmv,indravardhan,maya wo monisha ke ghar hi gayi thi. jugalkishore ne khud mujhe bataya ki wo isse pyaar karne laga hain,neutral
jugalkishore.wmv,maya,aise kaise? i mean abhi abhi to mila hain wo! pehele nazar mein hi pyaar?,neutral
jugalkishore.wmv,indravardhan,kyu nahi? 3rd flooe waali jo krishna hain wo jab peheli baar rosesh ko deekha tha to pehele hi nafrat karne lagi thi na? tp peheli nazar mein pyaar kyu nahi ho sakta?,neutral
jugalkishore.wmv,naisha,"i don't deny that jiju, mujhe bhi fernando ke peecha pagal hoone mein zyaada waqt nahi laga tha. jab mein pehele bah fernando ko dekha tha january 15th ko tab shaam ke 6 baj rahe the.",sadness
jugalkishore.wmv,rosesh,aur shaadi kab huyi thi?,neutral
jugalkishore.wmv,naisha,raat ko saare aat baje,sadness
jugalkishore.wmv,rosesh,usdin!,surprise
jugalkishore.wmv,maya,"it's all very well naisha, but the point is that uss jugalkishore ne tumhaare saath beazzati ki hain! he should not have behaved like this! no! indravardhan, tum ja ke abhi abhi usko samjhao ki wo naisha se dur rahe!",anger
jugalkishore.wmv,maya,naisha!,joy
jugalkishore.wmv,naisha,inaudible,sadness
jugalkishore.wmv,maya,kya hua? indu ne nahi poucha na tumhe lene airport?,fear
jugalkishore.wmv,naisha,no no he's downstairs. he's getting my luggage. but…,sadness
jugalkishore.wmv,maya,ohh come in come in come in…,sadness
jugalkishore.wmv,jugalkishore,hello balti!,neutral
jugalkishore.wmv,maya,what?,surprise
jugalkishore.wmv,jugalkishore,kuch nahi.,sadness
jugalkishore.wmv,naisha,tumne mujhe abhi balti kyu kaha?,neutral
jugalkishore.wmv,jugalkishore,"wo kaise sanjhaooon? wo balti jo hain na bohot bade dilwale hoti hain, wo pyaar aur mamta ka moorath hooti hain,",neutral
jugalkishore.wmv,maya,balti ha ha….tum itna sentimental kyu ho rahi ho? balti matlab bucket!,neutral
jugalkishore.wmv,naisha,i understand but what i wanted to know was that balti pyaar aur mamta ke murth kaise ho sakti hain!,sadness
jugalkishore.wmv,jugalkishore,kyu na? balti kitna saara paani apne aanchal mein samhaal leti hain! aur dhuye huye kaapde bhi. aur baddi baddi jailon mein to daal bhai balti se hi de jaati hain kaidion ko.,joy
jugalkishore.wmv,maya,monisha ke ghar pe balti ko ulta karke uske upar guests ko bhi bithati hain!,contempt
jugalkishore.wmv,jugalkishore,"wahi! samjho to devi, warna balti! isiliye meine aapko balti kaha tha.",neutral
jugalkishore.wmv,maya,stop crying! accha jugalkishore tum jaa rahe trhe na? bye!,neutral
jugalkishore.wmv,jugalkishore,excuse me! maine ap pe jo jakti ki maine uske liye bohot sharminda hun. phere lete waqt aap bohot haas rahi thi na to laga kya aap sayad khush ho.,neutral
jugalkishore.wmv,maya,phere lene ke time tum haas rahi thi?,surprise
jugalkishore.wmv,naisha,it was so romantic!,joy
jugalkishore.wmv,maya,"monisha ke gas ke aas paas phere lene ke time tumko laga ki wo romantic? monisha ke gas ke aas pass cockroaches phere lete hain! stop smiling at him! and jugalkishore, tumhaari lift aa gayi byee.",contempt
jugalkishore.wmv,naisha,"deets, he has this raw rular sex appeal! i think he's hot! ruko jugalkishore!",joy
jugalkishore.wmv,maya,"don't be silly! jugalkishore, ground floor ka button babao…byee.",neutral
jugalkishore.wmv,naisha,"one minute di, i think i…i love him!",joy
jugalkishore.wmv,jugalkishore,you will love me!,joy
jugalkishore.wmv,naisha,i love you right now you …. di i'm getting married,joy
jugalkishore.wmv,maya,"naisha…stop it, stop it….oh my god! indravadhan! ouch!",anger
kavi.wmv,rosesh,i hate him. i hate him mom.,anger
kavi.wmv,sahil,dad aap kyu eisa karte hain dad. rosesh ke sar par doodh ka glass khali karke kya mila aapko?,neutral
kavi.wmv,indravardhan,"sukoon! anand, chain, aaram! aatma ka dil ko khussi aur chehere ko muskaan",joy
kavi.wmv,sahil,"dad, dam to hain mom!",neutral
kavi.wmv,maya,"kya dum hain sahil! monisha ka baat sunkar mujhe bhi laagta hain ki paani ka glass phenku saarpe aur wo bhi yu dur se aise phenke maaru uske sir pe. don't mind beta, i'm just using you as an example. lekin kya ye karna sahi honga? caahe mujhe kitna bhi khussi mile?",anger
kavi.wmv,monisha,nahin!,anger
kavi.wmv,sahil,"lekin dad, aapne jo bhi kiya, galat kiya.",neutral
kavi.wmv,indravardhan,"kya galat kiya? tune rosesh ki poem suni? gobi ko huya baccha, isiliye khaana bana kaccha",anger
kavi.wmv,sahil,"hold it hold it….main maanta hoon rosesh ki kavita thodi si, thodi si…",neutral
kavi.wmv,maya,unusual,neutral
kavi.wmv,sahil,"haan….unusual hooti hain lekin dad, aap ko koi haq nahi banta rosesh ka kavita ko bura kehene ka",neutral
kavi.wmv,indravardhan,kya bola?,neutral
kavi.wmv,sahil,"bhool gaye, aap ke zaamane mein aap kavi dracula hua karte the. kya kavita thi dad ki…..dhinchak dhinchak chaale dil ki gari, dhukchuk dhukchuk chaale…something",contempt
kavi.wmv,indravardhan,aare yehi kavita suunke maya mere peeche pagal huyi thi,joy
kavi.wmv,rosesh,haan to? mere kavitain suunkar bhi ladkian mere picche pagal hooti hain!,joy
kavi.wmv,indravardhan,arey lo…..wo baal nochkar idhar udhar pagal hone ka pagal nahi…deewani hui thi mere picche samjha matlab?,anger
kavi.wmv,rosesh,reshma deewani hooti hain mere kavita sunke. hain na momma?,joy
kavi.wmv,maya,absolutely! tumhaare kavita suunke haar bar muskuraati hain wo.,joy
kavi.wmv,sahil,muskurati hi hogi. lekin ye reshma hain kaun?,neutral
kavi.wmv,monisha,"wahi jo chaar maale pe rehene aye hain….goongi, beheri.",joy
kavi.wmv,indravardhan,reshma goongi beheri bhi hain…bolo. ha ha ab samjha wo rosesh ka kavita sunke man hi man muskurate kyun hain…usse apna beherapan vardaan lagta hoga.,joy
kavi.wmv,maya,"nonsense indravardhan, iss saal art aur poetry club ke annual competition mein rosesh ka kavita ko award milega dekhna tum.",neutral
kavi.wmv,sahil,aur wo good news aap mujhe std karke batana,fear
kavi.wmv,maya,"ap rahoge sahil, hum saab yahin rahenge aur dekhenge ki ek bete ne apka krur aur ghamandi baap ko kaise harata hain!",anger
kavi.wmv,indravardhan,kya matlab?,neutral
kavi.wmv,maya,"kyu tum bhi to kavita likh chuke ho indravardhan, rosesh tumhe challenge karta hain go on challenge him!",neutral
kavi.wmv,rosesh,okay…i challenge you. aap ye kavi sammelan mein hissa lekar mujhe harakar dikhiye…tabhi ho jayega doodh ka doodh aur pani ka pani,neutral
kavi.wmv,indravardhan,ab to na mai srif tujhe haraunga doodh aur paani dono tere sar pe bhi daalunga…samjhe?,joy
kavi.wmv,rosesh,"bhurbhur bhurbhur ugalta paani, paani mein uglein chawal ki jawaani!",joy
kavi.wmv,indravardhan,"jawan hookar chawal sajayeenge thaali, lagayenge daal kaali kaali.",joy
kavi.wmv,rosesh,"bhoopu bhoopu aaya dekho, idliwala raju pardeshi,",joy
kavi.wmv,indravardhan,kaale bade cehere par daant bade aur aankhein zaara si.,joy
kavi.wmv,rosesh,roshni agar na ho aur raju khada ho saath,neutral
kavi.wmv,indravardhan,nazar mein ayenge srif uske chaar chamaktein daant…sahil sun na,joy
kavi.wmv,sahil,sun raha hoon. dekha iska nateeja….iska combination?,anger
kavi.wmv,monisha,"oye, itne bhi buuri nahi hain!",neutral
kavi.wmv,sahil,boori nahin hain! saabzi kiski bana rahi hain/,neutral
kavi.wmv,monisha,sabzi kuuch bhi banaya nahi…kya banayu/,neutral
kavi.wmv,sahil,kacche kele ki banao,anger
kavi.wmv,rosesh,kavi hain do rosesh aur indu…,joy
kavi.wmv,rosesh,gu gu gu gu…ha ha aise kavita likhte the dad? momma ab dekhna kaise dad apne ghutno ke par girte hain…mere kavita ke adha hissa hi to dad….,joy
kavi.wmv,maya,don't be overconfident! roseshh indravardhan bohot acche kavita bhi likh chuke hain...ye padho…ballavdas kaka kisradhanjjali,neutral
kavi.wmv,rosesh,sabke pyaare ballavdas kaka apko mila hoga swarg ka ilaka,neutral
kavi.wmv,maya,kaki nahi deti thi kisi se flirt karne ka chance aap main ka dekh rahein hain swarg mein urvashi ka dance,sadness
kavi.wmv,rosesh,wow very deep momma,neutral
kavi.wmv,maya,it is! wo to bohot saalo se indravardhan kuch likha nahi hain na to practice choot gayi hain warna he's a very talented poet!,neutral
kavi.wmv,rosesh,to ab kya hoga mumma?,fear
kavi.wmv,maya,"well, to ab tumhe kisi na kisi tarah jitana hoga! ab kavi sammelan humaare yahan hain hain na?",neutral
kavi.wmv,rosesh,to?,surprise
kavi.wmv,maya,judge kaun hain?,neutral
kavi.wmv,rosesh,art and poetry club ka sabse talented kavi…anirudh mehta,fear
kavi.wmv,maya,"excuse me ladies and gentleman, iss saal ka art and poetry club ka kavi sammelan mein aap sabka swagat hain! iss saal jin kaviyon ne hissa liya hain unke naam hain - mahesh parhansp, raghuvir jetmalani, shakeela moradabadi…i'm so sorry…gopi vetha, indravardhan sarabhai...",joy
kavi.wmv,monisha,east or west daddyji is the best!,joy
kavi.wmv,maya,"monisha, please…rosesh sarabhai….and iss saal humaare jo judge hain wo hain poet's guild award winner anirudh mehta urf.",joy
kavi.wmv,anirudh,kaccha kella,neutral
kavi.wmv,monisha,kaccha kela?,surprise
kavi.wmv,anirudh,mera takhallus..,neutral
kavi.wmv,monisha,lekin kaccha kela?,joy
kavi.wmv,anirudh,uyou see it’s a very deep metaphor…meri kavitayein samajna bohot mukil hota hain,neutral
kavi.wmv,monisha,to kaccha kela?,surprise
kavi.wmv,indravardhan,"naturally monisha, kaccha kela bhi to hazam karna muskil hota hain na?",joy
