episode,speakers,utterances,emotions
mayanighmare,dushyant,"jagtaap sharma..raymond glasses, cargo pants, made in hong kong?",neutral
mayanighmare,rosesh,kon jagtaap sharma?,neutral
mayanighmare,dushyant,"nae, cargo pants..jagtaap sharma..breakfast me chicken sandwich?",neutral
mayanighmare,maya,dushyant tum saaf-saaf kyun nahi bata sakte ki jagtaap sharma kon hai?,anger
mayanighmare,dushyant,sahil aur monisha ko aap jo bungalow lekar dene wali hain na wo ghonsla bunglow delhi me uska builder jagtaap sharma..wo fraud hai,anger
mayanighmare,maya,what are you saying?,fear
mayanighmare,dushyant,"uska builder jagtaap sharma, wo fraud hai. aur uski construction bhi faulty hai..aur maine to suna hai ki..wo jagtaap sharma part-time kidnapper bhi hai",neutral
mayanighmare,maya,what do you mean part-time kidnapper? dopehar ko do se chaar ke beech me kidnapping karta hai?,neutral
mayanighmare,dushyant,i don't know the exact timing,neutral
mayanighmare,maya,god iss aadmi ko sarcasm bhi nahi samajh me aata,contempt
mayanighmare,dushyant,huh?,neutral
mayanighmare,maya,haan..ahh,neutral
mayanighmare,dushyant,haan..in short wo bungalow mat khareedna..arey pados me wo pammi rehti hai na..wo bhi bungalow chhod kar jaane wali hai sumit adas ke husband ke sath rehne,neutral
mayanighmare,rosesh,momma that's bad news,fear
mayanighmare,maya,no..not unless only we know it...tumne monisha ko kuchh kaha iss bare me?,neutral
mayanighmare,dushyant,nai,neutral
mayanighmare,maya,"to mat batana please, please...please haan..kuchh mat bolna",neutral
mayanighmare,dushyant,okay okay if you insist,neutral
mayanighmare,maya,kaisa damaad mila hai humein,joy
mayanighmare,rosesh,cutie cutie,joy
mayanighmare,maya,accha suno..we have to think of something else now..,neutral
mayanighmare,rosesh,shayad aapko wo surprise dena chahte honge,neutral
mayanighmare,maya,"lekin monisha ko to pata tha. sahil ne apni sagi maa ko nahi btaya, lekin uss bahar wali ko pata tha",anger
mayanighmare,rosesh,momma wo bahar wali unki biwi hai,neutral
mayanighmare,maya,what's the matter with you? agar mai upset hun to meri haan me haan milana tumhare liye compulsory hai. samjhe?,anger
mayanighmare,rosesh,yes momma. phir se shuru karte hain?,fear
mayanighmare,maya,good,neutral
mayanighmare,rosesh,"arey rey...sahil bhai ne form bharne ke liye aap hi se pen manga, aur aap hi ko nahi bataya?",anger
mayanighmare,maya,dekho na,anger
mayanighmare,rosesh,"sahil bhai ne apni sagi maa se chhupaya? jis maa ne unhein nau-nau mahiney apne peit me rakh ke pala use nae bataya! aur uss anjaan, parai, outsider, stranger ko unhone....",anger
mayanighmare,maya,accha bas bas..don't over do it. and ye nau-nau mahiney peit me rakh kar pala and all that is just too hindi film han,contempt
mayanighmare,rosesh,"sorry, but now you are okay?",neutral
mayanighmare,maya,"no..i'm boiling. sahil dilli shift ho jaega monisha ke sath, monishha ke gharwalon ke kareeb. roz-roz unlogon ka aana jana hoga. monisha to khana bnaegi nahi, isliye rox lekar aaenge log, chhole bhature, lassi, um..sarson da saag..vinegar wale onions",anger
mayanighmare,rosesh,yuck..vinegar wale onions? yuh,disgust
mayanighmare,maya,vinegar wale onions are not so bad han...it's chhole bhature,disgust
mayanighmare,rosesh,yuck...chhole bhature?,disgust
mayanighmare,maya,"oh my god, mujhe ek horrible khayal aaya hai rosesh. sahil aur monisha ke bacche honge, wo yahan aaenge chhuttiyon me...humare ghar...mujhe biji-biji keh kar bulaenge...",fear
mayanighmare,bacche,biji..biji...biji...biji,joy
mayanighmare,sahil,maa namaste maa,joy
mayanighmare,monisha,pairi pauna mummy ji,joy
mayanighmare,sahil,"ohoho...aey bacchon, itthe aao, ye hota hai wadda tv",joy
mayanighmare,bacche,tv..tv..tv..tv,joy
mayanighmare,monisha,"oye chup oye..chup..oye ki wadda tv....chintu, mintu, happy, lucky, baggu..pehle biji ke paer to chhuo kamino..chalo",anger
mayanighmare,bacche,pairi paina biji,joy
mayanighmare,maya,accha accha bas..it's okay. god bless you all...and me,fear
mayanighmare,sahil,oo bacchon...ye lo kanche khelo..ye lo ye lo..kanche lo..aur ye..ye lo..khelo..haha..,joy
mayanighmare,maya,ooh...sahil..,fear
mayanighmare,sahil,arey haan.... bakasur bete yahan kyun baitha hai..arey biji ke paer pad,neutral
mayanighmare,bakasur,pairi pauna biji pairi pauna,joy
mayanighmare,maya,jeetey raho...iska naam bakasur hai?,fear
mayanighmare,monisha,"aaho...kinna cute hai na humara ye chhota sa rakshas. pta hai mummy ji, ye sab kuchh kha leta hai; pencil, jhadooo...",neutral
mayanighmare,sahil,oye chappal.. hangar da plastic. uss din to kamina wo tubelight hi kha gaya,joy
mayanighmare,maya,aur tumne khane di? don't do that,anger
mayanighmare,sahil,"umhm...purani thi..kis kaam ki, maine kaha khao beta",neutral
mayanighmare,bakasur,papa-papa..mujhe tatti jana hai,neutral
mayanighmare,sahil,"ooho hoo...monisha..chal sab bacchon ko tatti le ja.  o bacchon, biji ke ghar me ab do-do bathroom hai. jao jao oo jao jao",joy
mayanighmare,monisha,chalo chalo tatti chalo,joy
mayanighmare,bacche,chalo chalo chalo chalo,joy
mayanighmare,maya,arey ek minute wa...bathroom me rosesh hai,fear
mayanighmare,sahil,dono me?,neutral
mayanighmare,maya,haan? nae ek me repair work chal raha hai?,neutral
mayanighmare,sahil,ohoho..to bacchon ek minute...oye monisha ruk ja...o bakasur ko lekar itthe aaja. bakasur..aaj akhabar pe baith. baith ispe,neutral
mayanighmare,maya,aey..aey..ni..are you crazy..newspaper pe nae,anger
mayanighmare,sahil,kyun? padhna baqi hai?,neutral
mayanighmare,maya,sahil! newspaper pe potty karna is worse than middle class,anger
mayanighmare,sahil,ohoo monisha..ye dekh,surprise
mayanighmare,monisha,ki hoya?,neutral
mayanighmare,sahil,oye chashme ki frame par pachaas percent ka discount kr raha hai,surprise
mayanighmare,monisha,oo....ki keh rahe ho?,joy
mayanighmare,sahil,bacchon ke vastey khareed le chashme ke frame. kon pehnega chashme ki frame?,joy
mayanighmare,bacche,mai..mai..mai...mai,joy
mayanighmare,maya,"sahil, bacchon ko kya jarurat hai chashme ki?",neutral
mayanighmare,sahil,jarurat padegi maa...aage chal ke inn kamino ki nazar kamzor to hone hi wali hai. lower stall ki pehli row me baith ke picture jo dekhte hain..kaminey,joy
mayanighmare,maya,lower stall ke pehle row me?,contempt
mayanighmare,sahil,sasti padti hain na ticketein,joy
mayanighmare,monisha,accha ab chalo bhi,neutral
mayanighmare,sahil,"haan chalo chalo chalo..hum frame wrame khareed ke laate hain, aur bacchon biji ko tang mat karna. maa inhein zara sambhalna..mai truck start karta hun..chalo",neutral
mayanighmare,bacche,biji...biji...biji...biji...biji,joy
mayanighmare,maya,ek minute-ek minute..tumko potty aai thi na?,neutral
mayanighmare,bakasur,nae wo to ho gayi,joy
mayanighmare,maya,oh my god! we must stop this. this is a disaster..we must stop it,fear
mayanighmare,rosesh,you calm down momma...you..you calm down. relax. lemme see...lemme see...lemme see...momma..ek bohot hi interesting theory sikhai thi humare drama school ke albert sir ne,neutral
mayanighmare,maya,albert sir mtlab wo ladies gown,neutral
mayanighmare,rosesh,right. reverse theory,neutral
mayanighmare,maya,what's that?,neutral
mayanighmare,rosesh,"kabhi kabhi as an actor aapse jo reaction expect kiya jata hai, aap bilkul uska ulta kijiye. for example, agar aapka expected reaction is gussa..to smile. sahil bhai iss samay soch rahe honge ki aap unse gussa hongi to..",neutral
mayanighmare,maya,"mera reaction hoga cool, composed. infact happy",neutral
mayanighmare,rosesh,correct,joy
mayanighmare,rosesh,congratulations sahil bhai...,joy
mayanighmare,sahil,thank you thank you,joy
mayanighmare,maya,sahil bhai nae..dean sarabhai..,joy
mayanighmare,rosesh,oh yeah..maine aapke liye kavita bhi likhi hai,joy
mayanighmare,sahil,aaa...haha...abhi tak dean bana kahan hun mai. anyway thanks for this,fear
mayanighmare,maya,lekin maine tum dono ke liye dilli me rehne ka intezaam kar liya hai. have a look at this,joy
mayanighmare,rosesh,maharani baug ke posh locality me hai ye bungalow,joy
mayanighmare,sahil,oo,surprise
mayanighmare,maya,"haan...indravardhan, rosesh aur meri taraf se",joy
mayanighmare,monisha,muft me?,joy
mayanighmare,maya,haan monisha,neutral
mayanighmare,monisha,poora bungalow?,joy
mayanighmare,sahil,aadha...dete nae honge na?,neutral
mayanighmare,maya,nae kaatna bada mushqil hai,contempt
mayanighmare,rosesh,huhuhuhuhu,joy
mayanighmare,maya,lekin kaisa laga tumhein..?,joy
mayanighmare,sahil,it is lavish,joy
mayanighmare,maya,so is the neighbourhood,joy
mayanighmare,sahil,yeah?,joy
mayanighmare,maya,"pata hai, bungalow ke iss taraf kon rehta hai? pammi singh. pammi",neutral
mayanighmare,sahil,kon pammi?,neutral
mayanighmare,maya,"arey...hourglass figure, padmlaxami singh",neutral
mayanighmare,rosesh,accha wo divorcy..jiska dimpy sachdeva ke husband ke sath affair chal raha hai?,contempt
mayanighmare,maya,haan picchale saal chal raha tha..iss saal anuradha vaswani ke husband ke sath chal raha hai,contempt
mayanighmare,rosesh,"chhee...what a women i tell you bhabhi, uska humesha dusron ke husband ke sath hi affair chalta hai",contempt
mayanighmare,monisha,"mummy ji, wahan aur koi padosi hai?",fear
mayanighmare,maya,hai na...dekho iss taraf hai na..ye..dr. kamal puri ka bungalow hai.,neutral
mayanighmare,monisha,"phir to theek hai, hum dr. kamal puri ke sath hi dosti karenge...umm?",neutral
mayanighmare,rosesh,unka apna swimmming pool bhi hai bhabhi,neutral
mayanighmare,sahil,"great...to saturday sunday unke pool me jaenge hum tairne, what do you say?",joy
mayanighmare,rosesh,"absolutely, mai wahan bahar khade-khade bhutta sekungi, aur tum doctor kamal ji ke sath race lagana swimmimg pool me",joy
mayanighmare,maya,i wouldn't recommend that. kamal puri ex national swimming champion hai.,neutral
mayanighmare,sahil,waah,neutral
mayanighmare,maya,"kya tairati hai wo ladki, wooop",neutral
mayanighmare,monisha,ladki? sahil..swimmimg pool ke bahar nikalo..bahar nikalo,fear
mayanighmare,sahil,hello?,neutral
mayanighmare,maya,hahaha..she's jealous..o that's so sweet. i'm going to miss all this. so kya kehte ho? book kar dun? bungalow ka naam hai ghonsla.,joy
mayanighmare,monisha,mai uss sadiyal ghonsla bungalow me nahi jaungi nahi jaungi nahi jaungi,fear
mayanighmare,sahil,"come..come on monisha, mom ne itna accha ghar diya hai aur wahan ka view bhi kitna khoobsurat hai",neutral
mayanighmare,monisha,"haan haan..tumhein to view khoobsurat lagega hi..ek balcony se wo man eater, divorcy pammi singh dikhai padegi..angoor khati hui. aur dusri balcony se wo doctor kamal puri, bhains ki tarah swimmimng pool me padi hui. wahan pahunchte hi wo padosan darwaze pe hi khadi hogi...""doctor sahil, mere yahan ki sari bikini khatam ho gayi hai, please swimming ke liye ek bikini udhar doge? ahhuhhh please""",contempt
mayanighmare,sahil,"don't be crazy han monisha, wo doctor kamal puri kya bina kuchh pehne aise hi thode aaegi darwaaze pe",neutral
mayanighmare,monisha,maine aisa to nahi kaha sahil..lekin tumne use visualize kar liyana poora nangu-pangu?,anger
mayanighmare,sahil,oh no..give me a break..tumne kaha tha ki wo udhar ki bikini maangane aaegi..,neutral
mayanighmare,monisha,to? to kya? nangu-pangu? arey mai padosi ke yahan shakkar maangane jaati hun to kya khali dabba sath me lekar jaati hun..ki dekho..mera dabba khali hai..isme shakkar dedo,anger
mayanighmare,sahil,monisha tum kahan se kahan ja rahi ho?,anger
mayaonacleaningdrive.wmv,maya,paste control. pest control karvane ki kya jarurat hai monisha?,fear
mayaonacleaningdrive.wmv,monisha,vah bathroom mein chote chote cockroach ho gaye hain na,neutral
mayaonacleaningdrive.wmv,maya,"are kahan nahin hai cockroaches .do you know, duniya mein sabse pahle cockroaches paida hue the na?",neutral
mayaonacleaningdrive.wmv,monisha,ooh,surprise
mayaonacleaningdrive.wmv,maya,there's are the world's first citizen as a survivor. tumhare pest control ka koi bhi asar use per nahin padane wala,neutral
mayaonacleaningdrive.wmv,monisha,vaise mami ji aphi kahati hai ki mere guest bedroom mein bahut sare chuhe ho gaye hain.,sadness
mayaonacleaningdrive.wmv,rosesh,you know mama subah se plague fail sakta hai,fear
mayaonacleaningdrive.wmv,maya,"in chuho se nahin rosesh, vah to bade bade wild mote jungali rats wafale aata hai plague. yah to bichari chhote little baby mice",joy
mayaonacleaningdrive.wmv,rosesh,yeah yeah,joy
mayaonacleaningdrive.wmv,monisha,lekin rosesh bhaiya wo,neutral
mayaonacleaningdrive.wmv,maya,tum pest control karva kar un chhote chhote bezubaan janvaron ka sansar ujaran chahti ho beta,sadness
mayaonacleaningdrive.wmv,monisha,to theek hai main presscontrol walon se kah deti hu,sadness
mayaonacleaningdrive.wmv,maya,good,joy
mayaonacleaningdrive.wmv,monisha,ke pahle use chuha family ko kis salamat jayega pad pahochayein. uske bad ghar per dawai chhid ke.ok?,neutral
mayaonacleaningdrive.wmv,maya,monisha,neutral
mayaonacleaningdrive.wmv,monisha,i'm sorry mummy ji,sadness
mayaonacleaningdrive.wmv,maya,suno to,neutral
mayaonacleaningdrive.wmv,rosesh,mama. bhabhi to manhi nahin.ab kya hoga?,neutral
mayaonacleaningdrive.wmv,sahil,sach this great news,joy
mayaonacleaningdrive.wmv,vidisha,han sis bhi sunkar bahut khush hui,joy
mayaonacleaningdrive.wmv,sahil,congratulations vidisa mousi.,joy
mayaonacleaningdrive.wmv,vidisha,hey sahil behave yourself how dare you call me mousi ? mein tumhare mousi hu . kya mein tumhare mousi jaisi lagti hu?,sadness
mayaonacleaningdrive.wmv,sahil,nehi my sweetheart my wrexham my advantage my vesuvius volcano,joy
mayaonacleaningdrive.wmv,monisha,sahil me ghar chodkar,anger
mayaonacleaningdrive.wmv,sahil,vidisha ka ph hai,neutral
mayaonacleaningdrive.wmv,monisha,nahi ja rahi hoon. vidisha mousi ka ph hai.,joy
mayaonacleaningdrive.wmv,sahil,wo sadi kr rahi hain.,neutral
mayaonacleaningdrive.wmv,monisha,haaa! sach kiske sath?,joy
mayaonacleaningdrive.wmv,sahil,are haa kiske sath?,surprise
mayaonacleaningdrive.wmv,vidisha,ken ke sath,neutral
mayaonacleaningdrive.wmv,sahil,ken ke sath ?,neutral
mayaonacleaningdrive.wmv,vidisha,yea jorge sath,neutral
mayaonacleaningdrive.wmv,sahil,achcha abhi tsk taye nehi kiya apne?,contempt
mayaonacleaningdrive.wmv,vidisha,are sadi to mein kisi k sath v kar lungi that's not intention .lekin sadi to mein indian style mein hi karungi ishiliye mein india aa rahi hu.shopping karne.,joy
mayaonacleaningdrive.wmv,sahil,kab aa rahi hain india?,joy
mayaonacleaningdrive.wmv,monisha,aaaa! sach? mujhe do. hello namaste vidisha didi.,joy
mayaonacleaningdrive.wmv,vidisha,hi monisha.,joy
mayaonacleaningdrive.wmv,monisha,dekhiye ap jab chahein aa sakti hain. lekin ye aapki or meri paheli mulakaat hogi na to ishiliye apse mein kahe rahi hu apko mere ghar mein hi thaherna hoga. warna mein building ki terrace pe ja kaar jor jor se vidisha mousi kark pukarungi aapko,neutral
mayaonacleaningdrive.wmv,maya,no it's not all right rosesh in fact its vidisha monisha ke ghar par kaise rahe sakti hain ?,neutral
mayaonacleaningdrive.wmv,rosesh,unka guest bedroom to khali hain na,neutral
mayaonacleaningdrive.wmv,maya,"kaha khali hain , pichhle do saal se puri family thaheri hui hain wahan.",neutral
mayaonacleaningdrive.wmv,rosesh,family? kiske ?,surprise
mayaonacleaningdrive.wmv,maya,chuho ki.,neutral
mayaonacleaningdrive.wmv,rosesh,ooh,neutral
mayaonacleaningdrive.wmv,maya,ab itna time ho geya hain ki chuho monisha ko kiraye de rahe honge.,contempt
mayaonacleaningdrive.wmv,rosesh,u hu hu hu mama you are so funny.,joy
mayaonacleaningdrive.wmv,maya,"but this situations is not vidisha ko to tum jante ho na film dekhne jaati hai to 6 , 6 ke sit pe to disinfectant chidak ti hain.",neutral
mayaonacleaningdrive.wmv,rosesh,haan.or film mein koi chhikta hain to apna muh cover karti hai.,neutral
mayaonacleaningdrive.wmv,maya,that's right aur wo monisha k ghar mein rahengi .. ha ha ek to monisha ki ghar ki halat itni pathetic. or upor se uski middle class habits.naste mein vagi or pakore sarve kare gi 40 paise ki power k sath,disgust
mayaonacleaningdrive.wmv,rosesh,even bada pao,joy
mayaonacleaningdrive.wmv,maya,"right , or pao to tum jante ho na bread wala kaise banata hain,",contempt
mayaonacleaningdrive.wmv,rosesh,kaise?,neutral
mayaonacleaningdrive.wmv,maya,1 2 cha cha cha 1 2 cha cha cha,contempt
mayaonacleaningdrive.wmv,rosesh,mom is cha cha mein kya burai hai?,neutral
mayaonacleaningdrive.wmv,maya,wo cha cha cha pao ke aate k upor khare ho kar karta hain use gundne k liye,contempt
mayaonacleaningdrive.wmv,rosesh,chhaaaa! how gross,disgust
mayaonacleaningdrive.wmv,maya,ishiliye to ishe pao kahetein hain. nhi nhi nhi vidisha ke ane se pahele mujhe monisha ka ghar ka naksha badalna hi hoga.,neutral
mayaonacleaningdrive.wmv,rosesh,lekin bhabi apki baat sunti kaha hai?,neutral
mayaonacleaningdrive.wmv,rosesh,mama main jaundice per research kar liya hai,neutral
mayaonacleaningdrive.wmv,maya,a good,joy
mayaonacleaningdrive.wmv,rosesh,"to suniyee , jaundice also non medically as acterious is a condition characterize divide by yellow of the skin and white of the eyes it's a symptom not a disease it in self.the by pigment",neutral
mayaonacleaningdrive.wmv,maya,roses mujhe jaundice per phd nahin karni hai sweety e bi practical.,neutral
mayaonacleaningdrive.wmv,rosesh,theek hai jaundice mein khana hazam nahin hota ulti a jaati hai sharir kamjor ho jata hai,neutral
mayaonacleaningdrive.wmv,maya,ok,neutral
mayaonacleaningdrive.wmv,rosesh,let's doing,neutral
mayaonacleaningdrive.wmv,maya,no,neutral
mayaonacleaningdrive.wmv,rosesh,yeah,neutral
mayaonacleaningdrive.wmv,maya,oh my goodness,neutral
mayaonacleaningdrive.wmv,rosesh,chaliye apna chehra uttara uttara sa banaie,neutral
mayaonacleaningdrive.wmv,maya,it's a good,neutral
mayaonacleaningdrive.wmv,rosesh,"no thoda aur, thoda aur that's it up ulti aane ke acting kijiye",neutral
mayaonacleaningdrive.wmv,maya,waa,neutral
mayaonacleaningdrive.wmv,rosesh,mama this is very intensity ulti chhori dil se atma se aisa lagna chahie ki aapki rom rom ulti kar raha hai,neutral
mayaonacleaningdrive.wmv,maya,wooh wooh,neutral
mayaonacleaningdrive.wmv,rosesh,maya humari bedroom k diwar ko rang ko tuch up kara rahi h.,neutral
mayaonacleaningdrive.wmv,maya,ok woo,neutral
mayaonacleaningdrive.wmv,rosesh,sochiye aapke samne monisha bhabhi ki banai hui biryani rakhi hai,neutral
mayaonacleaningdrive.wmv,maya,ewwww,disgust
mayaonacleaningdrive.wmv,rosesh,that's it,joy
mayaonacleaningdrive.wmv,maya,but this ulti business is to down market rosesh. koi aur bimari dhundh do na kuchh aur symptom wali something is little more sophisticated,contempt
mayaonacleaningdrive.wmv,rosesh,ok let me see let me see.weakness ki vajah se chakkar,joy
mayaonacleaningdrive.wmv,maya,bingo.,joy
mayaonacleaningdrive.wmv,rosesh,"kiu my lord kiu, kya mrityu mere bhitar chhupe satrangi astitwo ka naas kar sakti hai ? mrityu to kebal alpabiram madhyam hai .kya moth mere anu anu mein chhupe us prakarsakh samrajya ka anth kar sakta hai ? jise hum paramatma ka kaam kahete hain.jabab dijiye my lord jabab dijiye.",anger
mayaonacleaningdrive.wmv,indravardhan,my lord ko ye sab samajh mein ataa hai?,neutral
mayaonacleaningdrive.wmv,rosesh,haan. or ye sab sunne ke baad wo mujhe fanshi ki saja suna dete hain.,neutral
mayaonacleaningdrive.wmv,indravardhan,"naturally, aisi dialogue sun ke to koi bhi tujhe fanshi ki saja suna dega fattu.yeh dialogue hai?",anger
mayaonacleaningdrive.wmv,rosesh,isme writer ka dard chhupa hein okay?,neutral
mayaonacleaningdrive.wmv,indravardhan,"konsa dard ?saar dard, kamar ka dard. aree ye writer tera kahena kya chahata hain? kahena kya chahata hain?",anger
mayaonacleaningdrive.wmv,rosesh,yehi ke fanshi atmaa ko maar nhi sakti hain,neutral
mayaonacleaningdrive.wmv,indravardhan,lo toh direct dialogue nhi likh sakta tha?,anger
mayaonacleaningdrive.wmv,rosesh,ye writer ka style hain.,anger
mayaonacleaningdrive.wmv,indravardhan,"style , suna vitthal?",neutral
mayaonacleaningdrive.wmv,vitthal,style.,neutral
mayaonacleaningdrive.wmv,indravardhan,stye. achha maab lo kiagaar ishi code mein tumhe bathroom jana hain to writwr kya likhe ga? ki my lord meri refrigerator mein chhupa hua jal ka botal main gale se a niche utaar ke apni juduwa kirni tak pahunchane ki jarurat ki hai. ab vahi jal is duniya mein punar janam leke aane ki zid kar baithi hai. to kya main iske prabal ichha ko purn karne ke liye shauchalay ja sakta hun? aise sidha ungali nahin dikhega. chai,neutral
mayaonacleaningdrive.wmv,maya,vitthal,neutral
mayaonacleaningdrive.wmv,vitthal,aaya bhabhi ji,neutral
mayaonacleaningdrive.wmv,rosesh,phone utha lo,neutral
mayaonacleaningdrive.wmv,indravardhan,main? main mard hun,neutral
mayaonacleaningdrive.wmv,maya,"ha ha fir se problem shuru ho gaya indu ka. main mard hun main mard hun, doctor ko kyon nahin dikhte? hello this is sarabhai residents",joy
mayaonacleaningdrive.wmv,vidisha,"hey sis ,vidisha",joy
mayaonacleaningdrive.wmv,maya,hai vidisha,joy
mayaonacleaningdrive.wmv,indravardhan,wo tera boyfriend kaisa hai walter walter,neutral
mayaonacleaningdrive.wmv,vidisha,jiju se kahiye ab waltor mera boyfriend nahin raha it's over ok,anger
mayaonacleaningdrive.wmv,maya,waltor nahin raha,neutral
mayaonacleaningdrive.wmv,indravardhan,"haan! mar gaya , kya hua kya hai suicide kya hua kya hai?",surprise
mayaonacleaningdrive.wmv,maya,walter ab iske boyfriend nahin raha,neutral
mayaonacleaningdrive.wmv,vidisha,aur suniye mein shaadi kar rahi hu.,neutral
mayaonacleaningdrive.wmv,maya,beta tumhare pass aur homeopathic,sadness
mayaonacleaningdrive.wmv,rosesh,mama,fear
mayaonacleaningdrive.wmv,maya,kon,neutral
mayaonacleaningdrive.wmv,indravardhan,maya humari bedroom k diwar ko rang ko tuch up kara rahi h.,neutral
mayaonacleaningdrive.wmv,monisha,kya? lekin mummy ji ko to rang se allergy hai wo waha rahe kaise payegi?,neutral
mayaonacleaningdrive.wmv,indravardhan,wo yeha akaar rahegi,neutral
mayaonacleaningdrive.wmv,monisha,haa yeh solution hai.,joy
mayaonacleaningdrive.wmv,indravardhan,buddhu ye solution nhi problem hai. zara socho maya yeha ayegi to kya hoga.,neutral
mayaonacleaningdrive.wmv,monisha,kya hoga?,neutral
mayaonacleaningdrive.wmv,indravardhan,kya hoga? yeh akhbaar pade ho kya?monisha ye akhbaaro ka dher is beautiful couch pe kabse pada hai?,neutral
mayaonacleaningdrive.wmv,monisha,mmmmm... yead nhi kafi dino se ish area mein aai nhi hu na.,neutral
mayaonacleaningdrive.wmv,indravardhan,oh i understand. kahar is ilaka mein to tumhara aana jana hoga na,neutral
mayaonacleaningdrive.wmv,monisha,han,joy
mayaonacleaningdrive.wmv,indravardhan,to batao ki yah kapdon ka dher yahan se kab se pada hoga?,joy
mayaonacleaningdrive.wmv,monisha,han ya 3 din se pada hua hai,joy
mayaonacleaningdrive.wmv,indravardhan,chalta hai na,joy
mayaonacleaningdrive.wmv,monisha,han,joy
mayaonacleaningdrive.wmv,indravardhan,apne hi to kapde hi ha ha. uthake phne to hai. ab kaun ise sambhal ke rakhne jaega hai na?,joy
mayaonacleaningdrive.wmv,monisha,aur nahin to kya how boring.,joy
mayaonacleaningdrive.wmv,indravardhan,lekin jab maya aaegi na to inka pedon ko apne hathon se uthana padega fir usse hanger per latkana padega fir majbur almari ka darwaja apne hathon se khol kar use hanger ko apne hathon se latkana padega at the same time is baat ka bhi kadak hona chahie ki do hanger ke bich mein kam se kam ek inchi ki jage ho,neutral
mayaonacleaningdrive.wmv,monisha,itna sab kuch karna padega ?ab main kya karun daddy ji?,fear
mayaonacleaningdrive.wmv,indravardhan,maiya ko kisi tarah yahan per dera jamane se roko.,anger
mayaonacleaningdrive.wmv,monisha,lekin kaise?,fear
mayaonacleaningdrive.wmv,indravardhan,pesticide chuhe cockroach aur khatmal marne ki dawai,joy
mayaonacleaningdrive.wmv,monisha,lekin mummy ji ko yah sab pilaenge kaise?,neutral
mayaonacleaningdrive.wmv,indravardhan,are monisha tum abhi tak jinda ho,neutral
mayaonacleaningdrive.wmv,monisha,aakhri saans le rahi hun bus mummy ji ne to mera jina haram kar diya hai,sadness
mayaonacleaningdrive.wmv,indravardhan,badhai ho,contempt
mayaonacleaningdrive.wmv,monisha,yah dekhiae mera khargosh itne pyar se is bathroom mein saja ke rakha tha mummy ji ne hata diya ja kehke ki monisha it's very down market,sadness
mayaonacleaningdrive.wmv,indravardhan,yah khargosh tumne khud banaya,neutral
mayaonacleaningdrive.wmv,monisha,nhi main aur sahil zoo beach gaye the na,neutral
mayaonacleaningdrive.wmv,indravardhan,achcha vahan se khareed ke lai ho ok ok,neutral
mayaonacleaningdrive.wmv,monisha,nahin nahin kharida nahin vahan per pada hua mila mummy ji ne hata diya isase aur vah mera husband vah manne ko taiyar hi nahin hai ki uska mummy natak kar rahi hai bimari ka,sadness
mayaonacleaningdrive.wmv,indravardhan,are sahil to uska blood report dekh kar bhi nahin manega.,neutral
mayaonacleaningdrive.wmv,indravardhan,blood report,joy
mayaonacleaningdrive.wmv,sahil,kya hua monisha?,neutral
mayaonacleaningdrive.wmv,monisha,tumhare mom ne kaha monisha you are impossible. main kya impossible hun,sadness
mayaonacleaningdrive.wmv,sahil,nahin tum to possible ho,neutral
mayaonacleaningdrive.wmv,monisha,han,sadness
mayaonacleaningdrive.wmv,sahil,matlab you know what i mean kya hua kya hai baby,neutral
mayaonacleaningdrive.wmv,monisha,main mummy ji ko napkin diya aur kaha ki is per mitti ka dava hai,sadness
mayaonacleaningdrive.wmv,sahil,to hoga mitti ka dava,neutral
mayaonacleaningdrive.wmv,monisha,nhi sahil mitti ka dava nahin tha main samjha samjha ke thak gai thi yah mitti ka dhaba nahin hai main is napkin ek bada sa machhar mara tha yah uska khoon hai jo sukh ke kala ho gaya. lekin tumhara mummy you are impossible you are impossible kaheke per sar patak ne lagi aur fir jor jor se chikne lagi,anger
mayaonacleaningdrive.wmv,sahil,chikne kyon lagi,neutral
mayaonacleaningdrive.wmv,monisha,kyunki takiyo se dhul ur rahi thi na,neutral
mayaonacleaningdrive.wmv,sahil,achcha,neutral
mayaonacleaningdrive.wmv,monisha,fir vahi khare khare unhone zid karke covers change karwayein. dadi ji dar sahi tha. mummy ji bimari ka bahana karke ghar mein ghusa ayi,sadness
